### ISSUE TITLE
write(descriptor:pointer:size:): Protocol wrong type for socket (errno: 41)

### ISSUE THREAD

**Issue by saroar** [swift-server/async-http-client#322]
{
    "error": true,
    "reason": "write(descriptor:pointer:size:): Protocol wrong type for socket (errno: 41)"
}

Xcode 12.3
macOS Big Sur 11.1

I have 4 vapor 4 app 1 is a gateway(API handler) rest of the vapor 4 API app everything was working good but after update my macOS Big Sur 11.0.1 to 11.1 I am getting this error 

I try to everything remove driver install all package but still same 

after debug 2 days I got this 

<img width="874" alt="Screenshot 2020-12-17 at 16 36 56" src="https://user-images.githubusercontent.com/8770772/102496787-e82e2400-4088-11eb-9559-2619d26a821d.png">
<img width="1158" alt="Screenshot 2020-12-17 at 16 33 30" src="https://user-images.githubusercontent.com/8770772/102496800-ed8b6e80-4088-11eb-9f09-0323152dfa85.png">

for now, I can run my app and I am stuck cant work with my vapor 4 app until this will solve 

all my app are open source so you can check them 
https://github.com/AddaMeSPB
https://github.com/AddaMeSPB/AddaAPIGateway here my gateway

**Comment by Lukasa** [comment]
Hmm, `EPROTOTYPE` is a very strange error to get here. It suggests that our file descriptor is in the process of being torn down. [This blog post](http://erickt.github.io/blog/2014/11/19/adventures-in-debugging-a-potential-osx-kernel-bug/) appears to cover the case. I'll see if I can put together a reproducer and then apply a relevant workaround.

**Comment by saroar** [comment]
@Lukasa thanks for quick reply

**Comment by saroar** [comment]
cant even install 
Installing creduce dependency: llvm@9
==> cmake -G Unix Makefiles .. -DLIBOMP_ARCH=x86_64 -DLINK_POLLY_INTO_TOOLS=ON -DLLVM_BUILD_EXTERNAL_COMPILER_RT=ON -DLLVM_BUILD_LLVM_DYLIB=ON -DLLVM_ENABLE_EH=ON -DLLVM_ENABLE_FFI=ON -DLLVM_ENABLE_LIBCX
==> make
Last 15 lines from /Users/alif/Library/Logs/Homebrew/llvm@9/02.make:
[ 72%] Building CXX object lib/sanitizer_common/CMakeFiles/RTSanitizerCommonNoHooks.ios.dir/sanitizer_tls_get_addr.cc.o
[ 73%] Building CXX object lib/sanitizer_common/CMakeFiles/RTSanitizerCommonNoHooks.ios.dir/sanitizer_thread_registry.cc.o
[ 73%] Building CXX object lib/sanitizer_common/CMakeFiles/RTSanitizerCommonNoHooks.ios.dir/sanitizer_type_traits.cc.o
[ 73%] Building CXX object lib/sanitizer_common/CMakeFiles/RTSanitizerCommonNoHooks.ios.dir/sanitizer_win.cc.o
[ 73%] Building CXX object lib/sanitizer_common/CMakeFiles/RTSanitizerCommonNoHooks.ios.dir/sanitizer_termination.cc.o
[ 73%] Built target RTSanitizerCommonNoHooks.ios
make[3]: *** [all] Error 2
make[2]: *** [tools/clang/runtime/compiler-rt-stamps/compiler-rt-build] Error 2
make[1]: *** [tools/clang/runtime/CMakeFiles/compiler-rt.dir/all] Error 2
make[1]: *** Waiting for unfinished jobs....
[100%] Linking CXX executable ../../../../bin/lldb-mi
cd /tmp/llvm@9-20201217-23001-10uu42z/llvm-9.0.1.src/build/tools/lldb/tools/lldb-mi && /usr/local/Cellar/cmake/3.19.1/bin/cmake -E cmake_link_script CMakeFiles/lldb-mi.dir/link.txt --verbose=1
/usr/local/Homebrew/Library/Homebrew/shims/mac/super/clang++  -stdlib=libc++ -fPIC -fvisibility-inlines-hidden -Werror=date-time -Werror=unguarded-availability-new -std=c++11 -Wall -Wextra -Wno-unused-parameter -Wwrite-strings -Wcast-qual -Wmissing-field-initializers -pedantic -Wno-long-long -Wimplicit-fallthrough -Wcovered-switch-default -Wno-class-memaccess -Wno-noexcept-type -Wnon-virtual-dtor -Wdelete-non-virtual-dtor -Wstring-conversion -Wno-deprecated-declarations -Wno-unknown-pragmas -Wno-strict-aliasing -Wno-deprecated-register -Wno-vla-extension -DNDEBUG -isysroot /Applications/Xcode.app/Contents/Developer/Platforms/MacOSX.platform/Developer/SDKs/MacOSX11.1.sdk -Wl,-search_paths_first -Wl,-headerpad_max_install_names  -stdlib=libc++  -Wl,-dead_strip CMakeFiles/lldb-mi.dir/MICmdArgContext.cpp.o CMakeFiles/lldb-mi.dir/MICmdArgSet.cpp.o CMakeFiles/lldb-mi.dir/MICmdArgValBase.cpp.o CMakeFiles/lldb-mi.dir/MICmdArgValConsume.cpp.o CMakeFiles/lldb-mi.dir/MICmdArgValFile.cpp.o CMakeFiles/lldb-mi.dir/MICmdArgValListBase.cpp.o CMakeFiles/lldb-mi.dir/MICmdArgValListOfN.cpp.o CMakeFiles/lldb-mi.dir/MICmdArgValNumber.cpp.o CMakeFiles/lldb-mi.dir/MICmdArgValOptionLong.cpp.o CMakeFiles/lldb-mi.dir/MICmdArgValOptionShort.cpp.o CMakeFiles/lldb-mi.dir/MICmdArgValPrintValues.cpp.o CMakeFiles/lldb-mi.dir/MICmdArgValString.cpp.o CMakeFiles/lldb-mi.dir/MICmdArgValThreadGrp.cpp.o CMakeFiles/lldb-mi.dir/MICmdBase.cpp.o CMakeFiles/lldb-mi.dir/MICmdCommands.cpp.o CMakeFiles/lldb-mi.dir/MICmdCmd.cpp.o CMakeFiles/lldb-mi.dir/MICmdCmdBreak.cpp.o CMakeFiles/lldb-mi.dir/MICmdCmdData.cpp.o CMakeFiles/lldb-mi.dir/MICmdCmdEnviro.cpp.o CMakeFiles/lldb-mi.dir/MICmdCmdExec.cpp.o CMakeFiles/lldb-mi.dir/MICmdCmdFile.cpp.o CMakeFiles/lldb-mi.dir/MICmdCmdGdbInfo.cpp.o CMakeFiles/lldb-mi.dir/MICmdCmdGdbSet.cpp.o CMakeFiles/lldb-mi.dir/MICmdCmdGdbShow.cpp.o CMakeFiles/lldb-mi.dir/MICmdCmdGdbThread.cpp.o CMakeFiles/lldb-mi.dir/MICmdCmdMiscellanous.cpp.o CMakeFiles/lldb-mi.dir/MICmdCmdStack.cpp.o CMakeFiles/lldb-mi.dir/MICmdCmdSupportInfo.cpp.o CMakeFiles/lldb-mi.dir/MICmdCmdSupportList.cpp.o CMakeFiles/lldb-mi.dir/MICmdCmdSymbol.cpp.o CMakeFiles/lldb-mi.dir/MICmdCmdTarget.cpp.o CMakeFiles/lldb-mi.dir/MICmdCmdThread.cpp.o CMakeFiles/lldb-mi.dir/MICmdCmdTrace.cpp.o CMakeFiles/lldb-mi.dir/MICmdCmdVar.cpp.o CMakeFiles/lldb-mi.dir/MICmdData.cpp.o CMakeFiles/lldb-mi.dir/MICmdFactory.cpp.o CMakeFiles/lldb-mi.dir/MICmdInterpreter.cpp.o CMakeFiles/lldb-mi.dir/MICmdInvoker.cpp.o CMakeFiles/lldb-mi.dir/MICmdMgr.cpp.o CMakeFiles/lldb-mi.dir/MICmdMgrSetCmdDeleteCallback.cpp.o CMakeFiles/lldb-mi.dir/MICmnBase.cpp.o CMakeFiles/lldb-mi.dir/MICmnLLDBBroadcaster.cpp.o CMakeFiles/lldb-mi.dir/MICmnLLDBDebugger.cpp.o CMakeFiles/lldb-mi.dir/MICmnLLDBDebuggerHandleEvents.cpp.o CMakeFiles/lldb-mi.dir/MICmnLLDBDebugSessionInfo.cpp.o CMakeFiles/lldb-mi.dir/MICmnLLDBDebugSessionInfoVarObj.cpp.o CMakeFiles/lldb-mi.dir/MICmnLLDBProxySBValue.cpp.o CMakeFiles/lldb-mi.dir/MICmnLLDBUtilSBValue.cpp.o CMakeFiles/lldb-mi.dir/MICmnLog.cpp.o CMakeFiles/lldb-mi.dir/MICmnLogMediumFile.cpp.o CMakeFiles/lldb-mi.dir/MICmnMIOutOfBandRecord.cpp.o CMakeFiles/lldb-mi.dir/MICmnMIResultRecord.cpp.o CMakeFiles/lldb-mi.dir/MICmnMIValue.cpp.o CMakeFiles/lldb-mi.dir/MICmnMIValueConst.cpp.o CMakeFiles/lldb-mi.dir/MICmnMIValueList.cpp.o CMakeFiles/lldb-mi.dir/MICmnMIValueResult.cpp.o CMakeFiles/lldb-mi.dir/MICmnMIValueTuple.cpp.o CMakeFiles/lldb-mi.dir/MICmnResources.cpp.o CMakeFiles/lldb-mi.dir/MICmnStreamStderr.cpp.o CMakeFiles/lldb-mi.dir/MICmnStreamStdin.cpp.o CMakeFiles/lldb-mi.dir/MICmnStreamStdout.cpp.o CMakeFiles/lldb-mi.dir/MICmnThreadMgrStd.cpp.o CMakeFiles/lldb-mi.dir/MIDriver.cpp.o CMakeFiles/lldb-mi.dir/MIDriverBase.cpp.o CMakeFiles/lldb-mi.dir/MIDriverMain.cpp.o CMakeFiles/lldb-mi.dir/MIDriverMgr.cpp.o CMakeFiles/lldb-mi.dir/MIUtilDateTimeStd.cpp.o CMakeFiles/lldb-mi.dir/MIUtilDebug.cpp.o CMakeFiles/lldb-mi.dir/MIUtilFileStd.cpp.o CMakeFiles/lldb-mi.dir/MIUtilMapIdToVariant.cpp.o CMakeFiles/lldb-mi.dir/MIUtilString.cpp.o CMakeFiles/lldb-mi.dir/MIUtilThreadBaseStd.cpp.o CMakeFiles/lldb-mi.dir/MIUtilVariant.cpp.o -o ../../../../bin/lldb-mi  -Wl,-rpath,@loader_path/../lib ../../../../lib/libLLVMSupport.a ../../../../lib/libLLVMSupport.a ../../../../lib/liblldb.9.0.1.dylib -lpthread -lz -lcurses -lm ../../../../lib/libLLVMDemangle.a
[100%] Built target lldb-mi
make: *** [all] Error 2

READ THIS: https://docs.brew.sh/Troubleshooting

These open issues may also help:
ldc: use llvm https://github.com/Homebrew/homebrew-core/pull/61117
 llvm@10 10.0.1 (new formula) https://github.com/Homebrew/homebrew-core/pull/63938
crystal: proper --HEAD build. Go back to llvm@9 https://github.com/Homebrew/homebrew-core/pull/65221
alif@Saroars-MacBook-Pro Pyramid %

**Comment by Lukasa** [comment]
You do not need to reduce this. This is a straightforward NIO bug, we don't need to generate a reproducer.

**Comment by Lukasa** [comment]
See apple/swift-nio#1706.

**Comment by saroar** [comment]
still have the same issue 
I clean the project remove the driver  after updateed the package 
:( name issue

**Comment by Lukasa** [comment]
We have not shipped a new patch release. You would have to switch to getting NIO from `master`.

**Comment by PeterAdams-A** [comment]
Where @Lukasa says `master` he actually means `main`

**Comment by saroar** [comment]
may i know when it will be shipped the new patch thanks

**Comment by saroar** [comment]
<img width="1066" alt="Screenshot 2020-12-18 at 12 05 44" src="https://user-images.githubusercontent.com/8770772/102595880-680bcb00-4129-11eb-8d65-1797bc05aacf.png">
i after build from `main` unlimeted time never end request

**Comment by Lukasa** [comment]
It seems likely you're hitting an error somewhere that isn't being fed back to your Vapor application. It's hard to debug this without more information from you. Do you have logging enabled?

**Comment by saroar** [comment]
@Lukasa my vapor 4 https://github.com/AddaMeSPB/AddaAPIGateway

**Comment by Lukasa** [comment]
We will need to see either logging or a network packet capture to make meaningful forward progress here. It seems like something is not being appropriately terminated, but we need more information to know exactly what.

**Comment by Lukasa** [comment]
Alternatively, you can use a debugger to intercept the behaviour of HTTP client and try to observe whether it is connecting, if it is connecting whether it is sending, and whether it is receiving any responses or errors.

**Comment by saroar** [comment]
I don't know how I can send you logs but sure I will sure if you guide me on how I can do it thanks @Lukasa

**Comment by saroar** [comment]
also note please MacOS Big Sur 11.0.1 was not this problem I am getting this problem after the update macOS Big Sur 11.1

**Comment by Lukasa** [comment]
Are you seeing any logs at all? If not @0xTim can advise on how to get logging out of Vapor's HTTP client.

**Comment by saroar** [comment]
about logs 
here what i see 
```
[ NOTICE ] Server starting on http://0.0.0.0:8080
2020-12-18 11:49:10.029071+0300 Run[91866:485603] [si_destination_compare] send failed: Invalid argument
2020-12-18 11:49:10.029568+0300 Run[91866:485603] [si_destination_compare] send failed: Undefined error: 0
[ INFO ] POST /v1/auth/login [request-id: 34899066-72CE-43AF-9CDD-5C1F41FE8A78]
[ INFO ] POST /v1/auth/login [request-id: 929908EB-726A-4DD2-8680-1CA3539FF8B2]
[ INFO ] GET /v1/events [request-id: C061808E-7E4E-4A75-9353-C966F6F0F80A]
[ INFO ] GET /v1/events [request-id: F366E87E-FB7B-4787-8F9D-5B473DC2B1FF]
[ INFO ] GET /v1/events [request-id: CBEF8756-D015-49DD-8F39-C99FB2AFC6E0]
```

**Comment by saroar** [comment]
the request was not sent and the client never get it

**Comment by Lukasa** [comment]
This logging does not appear to contain any logs from HTTP client. @0xTim should know whether that's expected behaviour.

**Comment by 0xTim** [comment]
@saroar you need to switch your Vapor branch to this https://github.com/vapor/vapor/pull/2476 and set the log level to trace in configure.swift. That should hook up logging with AHC

**Comment by saroar** [comment]
@0xTim
```
[ codes.vapor.application ] [ TRACE ] Decoded HTTP part: head: HTTPRequestHead { method: GET, uri: "/v1/events?page=1&per=5", version: HTTP/1.1, headers: [("Authorization", "Bearer eyJhbGciOiJSUzI1NiIsInR5cCI6IkpXVCJ9.eyJzdGF0dXMiOjAsImV4cCI6MTYxMDk1MjY1MSwiaWF0IjoxNjAyMzk5MDUxLCJ1c2VySWQiOiI1Zjc4ODI2YzE1NjA3NmY5NzFiMjVlN2IiLCJwaG9uZU51bWJlciI6Iis3OTIxODgyMTIxOCJ9.YRtyyC5DW82OcHZINSdisoK2S7B5eJ791c-c0HRSWB3G4Peis2t3CgRry1kcjIGg1dwC5JdSnwdS-orfxWo7F1gj8IBZL9MC2Lmpi0WCTwAAXdYntT7b2DiraCypnOQy3CE5n_OC32-zdZFmUz25HfvnAaD9VaCZvvdl9_O4lQNLMSg4HRMGN2Xv3VTbWeMpfQyEwPJ1Bd9OOGVTLEpvxSHnkXo8SbJ7drHRXH0gSz8ohkkYm_zw3dB0Ud3asoAaWcL3yNU_rtv9Z2uORbBH1ny3R4qIFItlgDURuQpgJwqKMVosmf0KLBfvSv2LaMBxKf07W00fE9Js-yPWrJsAuA"), ("Content-Type", "application/json"), ("User-Agent", "PostmanRuntime/7.26.8"), ("Accept", "*/*"), ("Postman-Token", "879185a4-d08f-486a-99b6-ade00bcb49bc"), ("Host", "localhost:8080"), ("Accept-Encoding", "gzip, deflate, br"), ("Connection", "keep-alive"), ("Content-Length", "239")] } (Vapor/HTTP/Server/HTTPServerRequestDecoder.swift:34)
[ codes.vapor.application ] [ TRACE ] Decoded HTTP part: body: ByteBuffer { readerIndex: 0, writerIndex: 239, readableBytes: 239, capacity: 239, storageCapacity: 2048, slice: _ByteBufferSlice { 828..<1067 }, storage: 0x000000010883b200 (2048 bytes) } (Vapor/HTTP/Server/HTTPServerRequestDecoder.swift:34)
[ codes.vapor.application ] [ TRACE ] Decoded HTTP part: end (Vapor/HTTP/Server/HTTPServerRequestDecoder.swift:34)
[ codes.vapor.application ] [ INFO ] GET /v1/events [request-id: C6F86A9C-C2CE-4093-8541-690BFD8A18CC] (Vapor/Responder/DefaultResponder.swift:42)
[ codes.vapor.application ] [ TRACE ] selected EventLoop for task given the preference [ahc-el-preference: delegate(on: SelectableEventLoop { selector = Selector { descriptor = 9 }, thread = NIOThread(name = NIO-ELT-0-#6), scheduledTasks = PriorityQueue(count: 0): [] }), ahc-eventloop: SelectableEventLoop { selector = Selector { descriptor = 9 }, thread = NIOThread(name = NIO-ELT-0-#6) }, ahc-request-id: 0] (AsyncHTTPClient/HTTPClient.swift:503)
[ codes.vapor.application ] [ TRACE ] opening fresh connection (no connections to reuse available) [ahc-request-id: 0] (AsyncHTTPClient/ConnectionPool.swift:243)
[ codes.vapor.application ] [ TRACE ] successfully created connection [ahc-connection: SocketChannel { BaseSocket { fd=14 }, active = true, localAddress = Optional([IPv4]127.0.0.1/127.0.0.1:51801), remoteAddress = Optional([IPv4]127.0.0.1/127.0.0.1:9090) }, ahc-request-id: 0] (AsyncHTTPClient/ConnectionPool.swift:315)
[ codes.vapor.application ] [ DEBUG ] got connection for request [ahc-channel-el: SelectableEventLoop { selector = Selector { descriptor = 9 }, thread = NIOThread(name = NIO-ELT-0-#6) }, ahc-connection: SocketChannel { BaseSocket { fd=14 }, active = true, localAddress = Optional([IPv4]127.0.0.1/127.0.0.1:51801), remoteAddress = Optional([IPv4]127.0.0.1/127.0.0.1:9090) }, ahc-request: GET http://0.0.0.0:9090/v1/events?page=1&per=5, ahc-request-id: 0, ahc-task-el: SelectableEventLoop { selector = Selector { descriptor = 9 }, thread = NIOThread(name = NIO-ELT-0-#6) }] (AsyncHTTPClient/HTTPClient.swift:557)

```

**Comment by saroar** [comment]
[ codes.vapor.application ] [ TRACE ] Decoded HTTP part: head: HTTPRequestHead { method: POST, uri: "/v1/auth/login", version: HTTP/1.1, headers: [("Content-Type", "application/json"), ("User-Agent", "PostmanRuntime/7.26.8"), ("Accept", "*/*"), ("Postman-Token", "f534b968-849d-4390-a96a-ed3cf412e198"), ("Host", "localhost:8080"), ("Accept-Encoding", "gzip, deflate, br"), ("Connection", "keep-alive"), ("Content-Length", "37")] } (Vapor/HTTP/Server/HTTPServerRequestDecoder.swift:34)
[ codes.vapor.application ] [ TRACE ] Decoded HTTP part: body: ByteBuffer { readerIndex: 0, writerIndex: 37, readableBytes: 37, capacity: 37, storageCapacity: 2048, slice: _ByteBufferSlice { 267..<304 }, storage: 0x000000010a015200 (2048 bytes) } (Vapor/HTTP/Server/HTTPServerRequestDecoder.swift:34)
[ codes.vapor.application ] [ TRACE ] Decoded HTTP part: end (Vapor/HTTP/Server/HTTPServerRequestDecoder.swift:34)
[ codes.vapor.application ] [ INFO ] POST /v1/auth/login [request-id: F1D0E358-5E24-4AB2-ACE1-E323C68460D5] (Vapor/Responder/DefaultResponder.swift:42)
[ codes.vapor.application ] [ TRACE ] selected EventLoop for task given the preference [ahc-el-preference: delegate(on: SelectableEventLoop { selector = Selector { descriptor = 6 }, thread = NIOThread(name = NIO-ELT-0-#3), scheduledTasks = PriorityQueue(count: 0): [] }), ahc-eventloop: SelectableEventLoop { selector = Selector { descriptor = 6 }, thread = NIOThread(name = NIO-ELT-0-#3) }, ahc-request-id: 1] (AsyncHTTPClient/HTTPClient.swift:503)
[ codes.vapor.application ] [ TRACE ] opening fresh connection (no connections to reuse available) [ahc-request-id: 1] (AsyncHTTPClient/ConnectionPool.swift:243)
[ codes.vapor.application ] [ TRACE ] successfully created connection [ahc-connection: SocketChannel { BaseSocket { fd=15 }, active = true, localAddress = Optional([IPv4]127.0.0.1/127.0.0.1:51845), remoteAddress = Optional([IPv4]127.0.0.1/127.0.0.1:3030) }, ahc-request-id: 1] (AsyncHTTPClient/ConnectionPool.swift:315)
[ codes.vapor.application ] [ DEBUG ] got connection for request [ahc-channel-el: SelectableEventLoop { selector = Selector { descriptor = 6 }, thread = NIOThread(name = NIO-ELT-0-#3) }, ahc-connection: SocketChannel { BaseSocket { fd=15 }, active = true, localAddress = Optional([IPv4]127.0.0.1/127.0.0.1:51845), remoteAddress = Optional([IPv4]127.0.0.1/127.0.0.1:3030) }, ahc-request: POST http://0.0.0.0:3030/v1/auth/login, ahc-request-id: 1, ahc-task-el: SelectableEventLoop { selector = Selector { descriptor = 6 }, thread = NIOThread(name = NIO-ELT-0-#3) }] (AsyncHTTPClient/HTTPClient.swift:557)

**Comment by Lukasa** [comment]
Yup, that is looking like we're sending our request but not getting a response. You seem to be connecting to some service on localhost:3030: what service is that, and what do its logs see?

**Comment by saroar** [comment]
that service is Vapor 4 API app not getting any request

**Comment by Lukasa** [comment]
Can you also enable the debug logging in that service and provide its logs?

**Comment by saroar** [comment]
sure

**Comment by 0xTim** [comment]
You need to integrate the same branches into that service and set trace logging on that

**Comment by saroar** [comment]
nothing empty not getting my request from gateway @Lukasa

**Comment by saroar** [comment]
@0xTim yes have done the same as I did with gateway Vapor 4 app

**Comment by 0xTim** [comment]
Why are you making a POST request to `0.0.0.0`? Shouldn't the IP be `127.0.01` or `localhost`?

**Comment by Lukasa** [comment]
Can you run `sudo tcpdump -i lo0 -nnvvXSs 8000 host 127.0.0.1 and port 3030` and re-run your test, then provide the output here?

**Comment by saroar** [comment]
@0xTim i am posting `http://localhost:8080/v1/auth/login`
<img width="732" alt="image" src="https://user-images.githubusercontent.com/8770772/102615885-b5973080-4147-11eb-9dc8-38b7b6397302.png">

**Comment by saroar** [comment]
@Lukasa 

```
alif@Saroars-MacBook-Pro Pyramid % sudo tcpdump -i lo0 -nnvvXSs 8000 host 127.0.0.1 and port 3030
Password:
tcpdump: listening on lo0, link-type NULL (BSD loopback), capture size 8000 bytes
```

**Comment by Lukasa** [comment]
You have to run your load as well. That's just the initial output.

**Comment by saroar** [comment]
```swift
alif@Saroars-MacBook-Pro Pyramid % sudo tcpdump -i lo0 -nnvvXSs 8000 host 127.0.0.1 and port 8080
tcpdump: listening on lo0, link-type NULL (BSD loopback), capture size 8000 bytes
```
load as well? do you mean from Xcode logs? if u mean yes then not logs there

**Comment by Lukasa** [comment]
I mean you have to issue your query through postman. Also, you're using the wrong port: I asked for port `3030`, not `8080`.

**Comment by saroar** [comment]
when I make a request using directly without gateway 
<img width="1069" alt="image" src="https://user-images.githubusercontent.com/8770772/102616254-50900a80-4148-11eb-84b6-75e178e04e86.png">
```swift
[ codes.vapor.application ] [ TRACE ] Decoded HTTP part: head: HTTPRequestHead { method: POST, uri: "/v1/auth/login", version: HTTP/1.1, headers: [("Content-Type", "application/json"), ("User-Agent", "PostmanRuntime/7.26.8"), ("Accept", "*/*"), ("Postman-Token", "a4653162-b53a-4115-91ba-4d96b53792fa"), ("Host", "localhost:3030"), ("Accept-Encoding", "gzip, deflate, br"), ("Connection", "keep-alive"), ("Content-Length", "37")] } (Vapor/HTTP/Server/HTTPServerRequestDecoder.swift:34)
[ codes.vapor.application ] [ TRACE ] Decoded HTTP part: body: ByteBuffer { readerIndex: 0, writerIndex: 37, readableBytes: 37, capacity: 37, storageCapacity: 2048, slice: _ByteBufferSlice { 267..<304 }, storage: 0x000000010300ea00 (2048 bytes) } (Vapor/HTTP/Server/HTTPServerRequestDecoder.swift:34)
[ codes.vapor.application ] [ TRACE ] Decoded HTTP part: end (Vapor/HTTP/Server/HTTPServerRequestDecoder.swift:34)
[ codes.vapor.application ] [ INFO ] POST /v1/auth/login [request-id: C69C004D-F4AE-4BA1-B820-075C9AF87A01] (Vapor/Responder/DefaultResponder.swift:42)
[ codes.vapor.application ] [ INFO ] SMS is Hello there! Your verification code is 911612 [request-id: C69C004D-F4AE-4BA1-B820-075C9AF87A01] (App/Controllers/AuthController.swift:40)
[ codes.vapor.application ] [ TRACE ] selected EventLoop for task given the preference [ahc-el-preference: delegate(on: SelectableEventLoop { selector = Selector { descriptor = 3 }, thread = NIOThread(name = NIO-ELT-0-#0), scheduledTasks = PriorityQueue(count: 0): [] }), ahc-eventloop: SelectableEventLoop { selector = Selector { descriptor = 3 }, thread = NIOThread(name = NIO-ELT-0-#0) }, ahc-request-id: 0] (AsyncHTTPClient/HTTPClient.swift:503)
[ codes.vapor.application ] [ TRACE ] opening fresh connection (no connections to reuse available) [ahc-request-id: 0] (AsyncHTTPClient/ConnectionPool.swift:243)
[ codes.vapor.application ] [ TRACE ] successfully created connection [ahc-connection: SocketChannel { BaseSocket { fd=17 }, active = true, localAddress = Optional([IPv4]10.0.1.3/10.0.1.3:0), remoteAddress = Optional([IPv4]34.200.73.123/34.200.73.123:443) }, ahc-request-id: 0] (AsyncHTTPClient/ConnectionPool.swift:315)
[ codes.vapor.application ] [ DEBUG ] got connection for request [ahc-channel-el: SelectableEventLoop { selector = Selector { descriptor = 3 }, thread = NIOThread(name = NIO-ELT-0-#0) }, ahc-connection: SocketChannel { BaseSocket { fd=17 }, active = true, localAddress = Optional([IPv4]10.0.1.3/10.0.1.3:0), remoteAddress = Optional([IPv4]34.200.73.123/34.200.73.123:443) }, ahc-request: POST https://api.twilio.com/2010-04-01/Accounts/AC76afb5c1e1d1564423a5dc395b80b303/Messages.json, ahc-request-id: 0, ahc-task-el: SelectableEventLoop { selector = Selector { descriptor = 3 }, thread = NIOThread(name = NIO-ELT-0-#0) }] (AsyncHTTPClient/HTTPClient.swift:557)
[ codes.vapor.application ] [ DEBUG ] releasing connection, request complete [ahc-closing: false, ahc-request-id: 0] (AsyncHTTPClient/ConnectionPool.swift:347)
[ codes.vapor.application ] [ TRACE ] parking connection [ahc-connection: SocketChannel { BaseSocket { fd=17 }, active = true, localAddress = Optional([IPv4]10.0.1.3/10.0.1.3:0), remoteAddress = Optional([IPv4]34.200.73.123/34.200.73.123:443) }, ahc-request-id: 0] (AsyncHTTPClient/ConnectionPool.swift:259)
code: 336699
[ codes.vapor.application ] [ DEBUG ] query create sms_verification_attempts input=[[phoneNumber: "+79218821219", expiresAt: Optional(2020-12-18 12:51:37 +0000), code: "336699", id: ObjectId("5fdca4addc6d76957707ed7d")]] [database-id: mongo, request-id: C69C004D-F4AE-4BA1-B820-075C9AF87A01] (FluentKit/Query/Builder/QueryBuilder.swift:297)
[ codes.vapor.application ] [ DEBUG ] fluent-mongo insert entities=[["phoneNumber": "+79218821219", "expiresAt": 2020-12-18 12:51:37 +0000, "code": "336699", "_id": ObjectId("5fdca4addc6d76957707ed7d")]] [database-id: mongo, request-id: C69C004D-F4AE-4BA1-B820-075C9AF87A01] (FluentMongoDriver/MongoDB+Create.swift:13)

```

**Comment by saroar** [comment]
@Lukasa it's my gateway app rest of my microservice via gateway app I am connecting with rest of microservice

**Comment by saroar** [comment]
https://rynaardb.com/posts/2019/02/23/microservices-with-vapor.html

**Comment by 0xTim** [comment]
@saroar you need to repeat the initial experiment, with the port that Cory asked for and make there request from Postman to the gateway so that we can collect the logs from the 2 different services and see the trace between the two (which is a connection via port 3030)

**Comment by saroar** [comment]
https://github.com/AddaMeSPB/AddaAPIGateway/blob/master/Sources/App/API/Auth/AuthAPIConfiguration.swift

**Comment by Lukasa** [comment]
I understand this. I am attempting to diagnose the actual problem. Your gateway app is successfully receiving requests, but it appears to be failing to send requests to the microservice backend. I am attempting to use tcpdump to work out whether any traffic is actually going to the backend or not, in order to isolate what is happening.

As the async-http-client logs _imply_ that a successful TCP connection is happening, we should absolutely see some logs in `tcpdump`.

**Comment by saroar** [comment]
no traffic going to from my gateway rit now 
`tcpdump`
<img width="1440" alt="image" src="https://user-images.githubusercontent.com/8770772/102617146-c183f200-4149-11eb-8c0d-3e8fe905aef2.png">

**Comment by Lukasa** [comment]
Are you sending any request via postman?

**Comment by Lukasa** [comment]
And I should say again, I don't actually care about traffic going to your gateway. We know that works. I'm interested in traffic going to the micro service that is behind your gateway.

**Comment by saroar** [comment]
I am sorry I got your point now 
```
alif@Saroars-MacBook-Pro Pyramid % sudo tcpdump -i lo0 -nnvvXSs 8000 host 127.0.0.1 and port 8080
Password:
tcpdump: listening on lo0, link-type NULL (BSD loopback), capture size 8000 bytes
15:59:07.341724 IP (tos 0x0, ttl 64, id 0, offset 0, flags [DF], proto TCP (6), length 64, bad cksum 0 (->3cb6)!)
    127.0.0.1.55344 > 127.0.0.1.8080: Flags [S], cksum 0xfe34 (incorrect -> 0x33cd), seq 1554493399, win 65535, options [mss 16344,nop,wscale 6,nop,nop,TS val 978750578 ecr 0,sackOK,eol], length 0
	0x0000:  4500 0040 0000 4000 4006 0000 7f00 0001  E..@..@.@.......
	0x0010:  7f00 0001 d830 1f90 5ca7 afd7 0000 0000  .....0..\.......
	0x0020:  b002 ffff fe34 0000 0204 3fd8 0103 0306  .....4....?.....
	0x0030:  0101 080a 3a56 8c72 0000 0000 0402 0000  ....:V.r........
15:59:07.341920 IP (tos 0x0, ttl 64, id 0, offset 0, flags [DF], proto TCP (6), length 64, bad cksum 0 (->3cb6)!)
    127.0.0.1.8080 > 127.0.0.1.55344: Flags [S.], cksum 0xfe34 (incorrect -> 0x7be0), seq 4231328989, ack 1554493400, win 65535, options [mss 16344,nop,wscale 6,nop,nop,TS val 978750578 ecr 978750578,sackOK,eol], length 0
	0x0000:  4500 0040 0000 4000 4006 0000 7f00 0001  E..@..@.@.......
	0x0010:  7f00 0001 1f90 d830 fc34 f4dd 5ca7 afd8  .......0.4..\...
	0x0020:  b012 ffff fe34 0000 0204 3fd8 0103 0306  .....4....?.....
	0x0030:  0101 080a 3a56 8c72 3a56 8c72 0402 0000  ....:V.r:V.r....
15:59:07.341945 IP (tos 0x0, ttl 64, id 0, offset 0, flags [DF], proto TCP (6), length 52, bad cksum 0 (->3cc2)!)
    127.0.0.1.55344 > 127.0.0.1.8080: Flags [.], cksum 0xfe28 (incorrect -> 0xdce9), seq 1554493400, ack 4231328990, win 6379, options [nop,nop,TS val 978750578 ecr 978750578], length 0
	0x0000:  4500 0034 0000 4000 4006 0000 7f00 0001  E..4..@.@.......
	0x0010:  7f00 0001 d830 1f90 5ca7 afd8 fc34 f4de  .....0..\....4..
	0x0020:  8010 18eb fe28 0000 0101 080a 3a56 8c72  .....(......:V.r
	0x0030:  3a56 8c72                                :V.r
15:59:07.341967 IP (tos 0x0, ttl 64, id 0, offset 0, flags [DF], proto TCP (6), length 52, bad cksum 0 (->3cc2)!)
    127.0.0.1.8080 > 127.0.0.1.55344: Flags [.], cksum 0xfe28 (incorrect -> 0xdce9), seq 4231328990, ack 1554493400, win 6379, options [nop,nop,TS val 978750578 ecr 978750578], length 0
	0x0000:  4500 0034 0000 4000 4006 0000 7f00 0001  E..4..@.@.......
	0x0010:  7f00 0001 1f90 d830 fc34 f4de 5ca7 afd8  .......0.4..\...
	0x0020:  8010 18eb fe28 0000 0101 080a 3a56 8c72  .....(......:V.r
	0x0030:  3a56 8c72                                :V.r
15:59:07.343140 IP (tos 0x0, ttl 64, id 0, offset 0, flags [DF], proto TCP (6), length 356, bad cksum 0 (->3b92)!)
    127.0.0.1.55344 > 127.0.0.1.8080: Flags [P.], cksum 0xff58 (incorrect -> 0xf671), seq 1554493400:1554493704, ack 4231328990, win 6379, options [nop,nop,TS val 978750579 ecr 978750578], length 304: HTTP, length: 304
	POST /v1/auth/login HTTP/1.1
	Content-Type: application/json
	User-Agent: PostmanRuntime/7.26.8
	Accept: */*
	Postman-Token: 32249539-ebdf-4abc-80ad-e15067251ec2
	Host: localhost:8080
	Accept-Encoding: gzip, deflate, br
	Connection: keep-alive
	Content-Length: 37

	{
	    "phoneNumber": "+79218821219"
	}[!http]
	0x0000:  4500 0164 0000 4000 4006 0000 7f00 0001  E..d..@.@.......
	0x0010:  7f00 0001 d830 1f90 5ca7 afd8 fc34 f4de  .....0..\....4..
	0x0020:  8018 18eb ff58 0000 0101 080a 3a56 8c73  .....X......:V.s
	0x0030:  3a56 8c72 504f 5354 202f 7631 2f61 7574  :V.rPOST./v1/aut
	0x0040:  682f 6c6f 6769 6e20 4854 5450 2f31 2e31  h/login.HTTP/1.1
	0x0050:  0d0a 436f 6e74 656e 742d 5479 7065 3a20  ..Content-Type:.
	0x0060:  6170 706c 6963 6174 696f 6e2f 6a73 6f6e  application/json
	0x0070:  0d0a 5573 6572 2d41 6765 6e74 3a20 506f  ..User-Agent:.Po
	0x0080:  7374 6d61 6e52 756e 7469 6d65 2f37 2e32  stmanRuntime/7.2
	0x0090:  362e 380d 0a41 6363 6570 743a 202a 2f2a  6.8..Accept:.*/*
	0x00a0:  0d0a 506f 7374 6d61 6e2d 546f 6b65 6e3a  ..Postman-Token:
	0x00b0:  2033 3232 3439 3533 392d 6562 6466 2d34  .32249539-ebdf-4
	0x00c0:  6162 632d 3830 6164 2d65 3135 3036 3732  abc-80ad-e150672
	0x00d0:  3531 6563 320d 0a48 6f73 743a 206c 6f63  51ec2..Host:.loc
	0x00e0:  616c 686f 7374 3a38 3038 300d 0a41 6363  alhost:8080..Acc
	0x00f0:  6570 742d 456e 636f 6469 6e67 3a20 677a  ept-Encoding:.gz
	0x0100:  6970 2c20 6465 666c 6174 652c 2062 720d  ip,.deflate,.br.
	0x0110:  0a43 6f6e 6e65 6374 696f 6e3a 206b 6565  .Connection:.kee
	0x0120:  702d 616c 6976 650d 0a43 6f6e 7465 6e74  p-alive..Content
	0x0130:  2d4c 656e 6774 683a 2033 370d 0a0d 0a7b  -Length:.37....{
	0x0140:  0a20 2020 2022 7068 6f6e 654e 756d 6265  ....."phoneNumbe
	0x0150:  7222 3a20 222b 3739 3231 3838 3231 3231  r":."+7921882121
	0x0160:  3922 0a7d                                9".}
15:59:07.343173 IP (tos 0x0, ttl 64, id 0, offset 0, flags [DF], proto TCP (6), length 52, bad cksum 0 (->3cc2)!)
    127.0.0.1.8080 > 127.0.0.1.55344: Flags [.], cksum 0xfe28 (incorrect -> 0xdbbc), seq 4231328990, ack 1554493704, win 6374, options [nop,nop,TS val 978750579 ecr 978750579], length 0
	0x0000:  4500 0034 0000 4000 4006 0000 7f00 0001  E..4..@.@.......
	0x0010:  7f00 0001 1f90 d830 fc34 f4de 5ca7 b108  .......0.4..\...
	0x0020:  8010 18e6 fe28 0000 0101 080a 3a56 8c73  .....(......:V.s
	0x0030:  3a56 8c73                                :V.s

```

**Comment by Lukasa** [comment]
That's great, but you're listening for the wrong port. I still need the traffic to port 3030.

**Comment by saroar** [comment]
```swift
alif@Saroars-MacBook-Pro ~ % sudo tcpdump -i lo0 -nnvvXSs 8000 host 127.0.0.1 and port 3030
Password:
tcpdump: listening on lo0, link-type NULL (BSD loopback), capture size 8000 bytes
16:05:00.145226 IP (tos 0x0, ttl 64, id 4466, offset 0, flags [none], proto TCP (6), length 40, bad cksum 0 (->6b5c)!)
    127.0.0.1.54157 > 127.0.0.1.3030: Flags [.], cksum 0xfe1c (incorrect -> 0xfe0c), seq 3586560182, ack 3741480445, win 6372, length 0
	0x0000:  4500 0028 1172 0000 4006 0000 7f00 0001  E..(.r..@.......
	0x0010:  7f00 0001 d38d 0bd6 d5c6 90b6 df02 75fd  ..............u.
	0x0020:  5010 18e4 fe1c 0000                      P.......
16:05:00.145264 IP (tos 0x0, ttl 64, id 0, offset 0, flags [DF], proto TCP (6), length 52, bad cksum 0 (->3cc2)!)
    127.0.0.1.3030 > 127.0.0.1.54157: Flags [.], cksum 0xfe28 (incorrect -> 0x103c), seq 3741480445, ack 3586560183, win 6370, options [nop,nop,TS val 979098633 ecr 978740223], length 0
	0x0000:  4500 0034 0000 4000 4006 0000 7f00 0001  E..4..@.@.......
	0x0010:  7f00 0001 0bd6 d38d df02 75fd d5c6 90b7  ..........u.....
	0x0020:  8010 18e2 fe28 0000 0101 080a 3a5b dc09  .....(......:[..
	0x0030:  3a56 63ff                                :Vc.
16:05:01.150484 IP (tos 0x0, ttl 64, id 27608, offset 0, flags [none], proto TCP (6), length 40, bad cksum 0 (->10f6)!)
    127.0.0.1.54157 > 127.0.0.1.3030: Flags [.], cksum 0xfe1c (incorrect -> 0xfe0c), seq 3586560182, ack 3741480445, win 6372, length 0
	0x0000:  4500 0028 6bd8 0000 4006 0000 7f00 0001  E..(k...@.......
	0x0010:  7f00 0001 d38d 0bd6 d5c6 90b6 df02 75fd  ..............u.
	0x0020:  5010 18e4 fe1c 0000                      P.......
16:05:01.150519 IP (tos 0x0, ttl 64, id 0, offset 0, flags [DF], proto TCP (6), length 52, bad cksum 0 (->3cc2)!)
    127.0.0.1.3030 > 127.0.0.1.54157: Flags [.], cksum 0xfe28 (incorrect -> 0x0c54), seq 3741480445, ack 3586560183, win 6370, options [nop,nop,TS val 979099633 ecr 978740223], length 0
	0x0000:  4500 0034 0000 4000 4006 0000 7f00 0001  E..4..@.@.......
	0x0010:  7f00 0001 0bd6 d38d df02 75fd d5c6 90b7  ..........u.....
	0x0020:  8010 18e2 fe28 0000 0101 080a 3a5b dff1  .....(......:[..
	0x0030:  3a56 63ff                                :Vc.
16:05:02.155670 IP (tos 0x0, ttl 64, id 38111, offset 0, flags [none], proto TCP (6), length 40, bad cksum 0 (->e7ee)!)
    127.0.0.1.54157 > 127.0.0.1.3030: Flags [.], cksum 0xfe1c (incorrect -> 0xfe0c), seq 3586560182, ack 3741480445, win 6372, length 0
	0x0000:  4500 0028 94df 0000 4006 0000 7f00 0001  E..(....@.......
	0x0010:  7f00 0001 d38d 0bd6 d5c6 90b6 df02 75fd  ..............u.
	0x0020:  5010 18e4 fe1c 0000                      P.......
16:05:02.155715 IP (tos 0x0, ttl 64, id 0, offset 0, flags [DF], proto TCP (6), length 52, bad cksum 0 (->3cc2)!)
    127.0.0.1.3030 > 127.0.0.1.54157: Flags [.], cksum 0xfe28 (incorrect -> 0x086b), seq 3741480445, ack 3586560183, win 6370, options [nop,nop,TS val 979100634 ecr 978740223], length 0
	0x0000:  4500 0034 0000 4000 4006 0000 7f00 0001  E..4..@.@.......
	0x0010:  7f00 0001 0bd6 d38d df02 75fd d5c6 90b7  ..........u.....
	0x0020:  8010 18e2 fe28 0000 0101 080a 3a5b e3da  .....(......:[..
	0x0030:  3a56 63ff                                :Vc.
16:05:03.656443 IP (tos 0x0, ttl 64, id 17853, offset 0, flags [none], proto TCP (6), length 40, bad cksum 0 (->3711)!)
    127.0.0.1.54157 > 127.0.0.1.3030: Flags [.], cksum 0xfe1c (incorrect -> 0xfe0c), seq 3586560182, ack 3741480445, win 6372, length 0
	0x0000:  4500 0028 45bd 0000 4006 0000 7f00 0001  E..(E...@.......
	0x0010:  7f00 0001 d38d 0bd6 d5c6 90b6 df02 75fd  ..............u.
	0x0020:  5010 18e4 fe1c 0000                      P.......
16:05:03.656483 IP (tos 0x0, ttl 64, id 0, offset 0, flags [DF], proto TCP (6), length 52, bad cksum 0 (->3cc2)!)
    127.0.0.1.3030 > 127.0.0.1.54157: Flags [.], cksum 0xfe28 (incorrect -> 0x0291), seq 3741480445, ack 3586560183, win 6370, options [nop,nop,TS val 979102132 ecr 978740223], length 0
	0x0000:  4500 0034 0000 4000 4006 0000 7f00 0001  E..4..@.@.......
	0x0010:  7f00 0001 0bd6 d38d df02 75fd d5c6 90b7  ..........u.....
	0x0020:  8010 18e2 fe28 0000 0101 080a 3a5b e9b4  .....(......:[..
	0x0030:  3a56 63ff                                :Vc.
16:05:04.757608 IP (tos 0x0, ttl 64, id 37412, offset 0, flags [none], proto TCP (6), length 40, bad cksum 0 (->eaa9)!)
    127.0.0.1.54157 > 127.0.0.1.3030: Flags [.], cksum 0xfe1c (incorrect -> 0xfe0c), seq 3586560182, ack 3741480445, win 6372, length 0
	0x0000:  4500 0028 9224 0000 4006 0000 7f00 0001  E..(.$..@.......
	0x0010:  7f00 0001 d38d 0bd6 d5c6 90b6 df02 75fd  ..............u.
	0x0020:  5010 18e4 fe1c 0000                      P.......
16:05:04.757646 IP (tos 0x0, ttl 64, id 0, offset 0, flags [DF], proto TCP (6), length 52, bad cksum 0 (->3cc2)!)
    127.0.0.1.3030 > 127.0.0.1.54157: Flags [.], cksum 0xfe28 (incorrect -> 0xfe47), seq 3741480445, ack 3586560183, win 6370, options [nop,nop,TS val 979103229 ecr 978740223], length 0
	0x0000:  4500 0034 0000 4000 4006 0000 7f00 0001  E..4..@.@.......
	0x0010:  7f00 0001 0bd6 d38d df02 75fd d5c6 90b7  ..........u.....
	0x0020:  8010 18e2 fe28 0000 0101 080a 3a5b edfd  .....(......:[..
	0x0030:  3a56 63ff                                :Vc.
16:05:05.758053 IP (tos 0x0, ttl 64, id 47386, offset 0, flags [none], proto TCP (6), length 40, bad cksum 0 (->c3b3)!)
    127.0.0.1.54157 > 127.0.0.1.3030: Flags [.], cksum 0xfe1c (incorrect -> 0xfe0c), seq 3586560182, ack 3741480445, win 6372, length 0
	0x0000:  4500 0028 b91a 0000 4006 0000 7f00 0001  E..(....@.......
	0x0010:  7f00 0001 d38d 0bd6 d5c6 90b6 df02 75fd  ..............u.
	0x0020:  5010 18e4 fe1c 0000                      P.......
16:05:05.758120 IP (tos 0x0, ttl 64, id 0, offset 0, flags [DF], proto TCP (6), length 52, bad cksum 0 (->3cc2)!)
    127.0.0.1.3030 > 127.0.0.1.54157: Flags [.], cksum 0xfe28 (incorrect -> 0xfa5f), seq 3741480445, ack 3586560183, win 6370, options [nop,nop,TS val 979104229 ecr 978740223], length 0
	0x0000:  4500 0034 0000 4000 4006 0000 7f00 0001  E..4..@.@.......
	0x0010:  7f00 0001 0bd6 d38d df02 75fd d5c6 90b7  ..........u.....
	0x0020:  8010 18e2 fe28 0000 0101 080a 3a5b f1e5  .....(......:[..
	0x0030:  3a56 63ff                                :Vc.
16:05:06.759175 IP (tos 0x0, ttl 64, id 40692, offset 0, flags [none], proto TCP (6), length 40, bad cksum 0 (->ddd9)!)
    127.0.0.1.54157 > 127.0.0.1.3030: Flags [.], cksum 0xfe1c (incorrect -> 0xfe0c), seq 3586560182, ack 3741480445, win 6372, length 0
	0x0000:  4500 0028 9ef4 0000 4006 0000 7f00 0001  E..(....@.......
	0x0010:  7f00 0001 d38d 0bd6 d5c6 90b6 df02 75fd  ..............u.
	0x0020:  5010 18e4 fe1c 0000                      P.......
16:05:06.759233 IP (tos 0x0, ttl 64, id 0, offset 0, flags [DF], proto TCP (6), length 52, bad cksum 0 (->3cc2)!)
    127.0.0.1.3030 > 127.0.0.1.54157: Flags [.], cksum 0xfe28 (incorrect -> 0xf677), seq 3741480445, ack 3586560183, win 6370, options [nop,nop,TS val 979105229 ecr 978740223], length 0
	0x0000:  4500 0034 0000 4000 4006 0000 7f00 0001  E..4..@.@.......
	0x0010:  7f00 0001 0bd6 d38d df02 75fd d5c6 90b7  ..........u.....
	0x0020:  8010 18e2 fe28 0000 0101 080a 3a5b f5cd  .....(......:[..
	0x0030:  3a56 63ff                                :Vc.
16:05:08.195206 IP (tos 0x0, ttl 64, id 38945, offset 0, flags [none], proto TCP (6), length 40, bad cksum 0 (->e4ac)!)
    127.0.0.1.54157 > 127.0.0.1.3030: Flags [.], cksum 0xfe1c (incorrect -> 0xfe0c), seq 3586560182, ack 3741480445, win 6372, length 0
	0x0000:  4500 0028 9821 0000 4006 0000 7f00 0001  E..(.!..@.......
	0x0010:  7f00 0001 d38d 0bd6 d5c6 90b6 df02 75fd  ..............u.
	0x0020:  5010 18e4 fe1c 0000                      P.......
16:05:08.195261 IP (tos 0x0, ttl 64, id 0, offset 0, flags [DF], proto TCP (6), length 52, bad cksum 0 (->3cc2)!)
    127.0.0.1.3030 > 127.0.0.1.54157: Flags [.], cksum 0xfe28 (incorrect -> 0xf0dc), seq 3741480445, ack 3586560183, win 6370, options [nop,nop,TS val 979106664 ecr 978740223], length 0
	0x0000:  4500 0034 0000 4000 4006 0000 7f00 0001  E..4..@.@.......
	0x0010:  7f00 0001 0bd6 d38d df02 75fd d5c6 90b7  ..........u.....
	0x0020:  8010 18e2 fe28 0000 0101 080a 3a5b fb68  .....(......:[.h
	0x0030:  3a56 63ff                                :Vc.
16:05:09.199295 IP (tos 0x0, ttl 64, id 62337, offset 0, flags [none], proto TCP (6), length 40, bad cksum 0 (->894c)!)
    127.0.0.1.54157 > 127.0.0.1.3030: Flags [.], cksum 0xfe1c (incorrect -> 0xfe0c), seq 3586560182, ack 3741480445, win 6372, length 0
	0x0000:  4500 0028 f381 0000 4006 0000 7f00 0001  E..(....@.......
	0x0010:  7f00 0001 d38d 0bd6 d5c6 90b6 df02 75fd  ..............u.
	0x0020:  5010 18e4 fe1c 0000                      P.......
16:05:09.199331 IP (tos 0x0, ttl 64, id 0, offset 0, flags [DF], proto TCP (6), length 52, bad cksum 0 (->3cc2)!)
    127.0.0.1.3030 > 127.0.0.1.54157: Flags [.], cksum 0xfe28 (incorrect -> 0xecf4), seq 3741480445, ack 3586560183, win 6370, options [nop,nop,TS val 979107664 ecr 978740223], length 0
	0x0000:  4500 0034 0000 4000 4006 0000 7f00 0001  E..4..@.@.......
	0x0010:  7f00 0001 0bd6 d38d df02 75fd d5c6 90b7  ..........u.....
	0x0020:  8010 18e2 fe28 0000 0101 080a 3a5b ff50  .....(......:[.P
	0x0030:  3a56 63ff                                :Vc.
16:05:10.199973 IP (tos 0x0, ttl 64, id 18493, offset 0, flags [none], proto TCP (6), length 40, bad cksum 0 (->3491)!)
    127.0.0.1.54157 > 127.0.0.1.3030: Flags [.], cksum 0xfe1c (incorrect -> 0xfe0c), seq 3586560182, ack 3741480445, win 6372, length 0
	0x0000:  4500 0028 483d 0000 4006 0000 7f00 0001  E..(H=..@.......
	0x0010:  7f00 0001 d38d 0bd6 d5c6 90b6 df02 75fd  ..............u.
	0x0020:  5010 18e4 fe1c 0000                      P.......
16:05:10.200023 IP (tos 0x0, ttl 64, id 0, offset 0, flags [DF], proto TCP (6), length 52, bad cksum 0 (->3cc2)!)
    127.0.0.1.3030 > 127.0.0.1.54157: Flags [.], cksum 0xfe28 (incorrect -> 0xe90c), seq 3741480445, ack 3586560183, win 6370, options [nop,nop,TS val 979108664 ecr 978740223], length 0
	0x0000:  4500 0034 0000 4000 4006 0000 7f00 0001  E..4..@.@.......
	0x0010:  7f00 0001 0bd6 d38d df02 75fd d5c6 90b7  ..........u.....
	0x0020:  8010 18e2 fe28 0000 0101 080a 3a5c 0338  .....(......:\.8
	0x0030:  3a56 63ff                                :Vc.
16:05:11.254173 IP (tos 0x0, ttl 64, id 34340, offset 0, flags [none], proto TCP (6), length 40, bad cksum 0 (->f6a9)!)
    127.0.0.1.54157 > 127.0.0.1.3030: Flags [.], cksum 0xfe1c (incorrect -> 0xfe0c), seq 3586560182, ack 3741480445, win 6372, length 0
	0x0000:  4500 0028 8624 0000 4006 0000 7f00 0001  E..(.$..@.......
	0x0010:  7f00 0001 d38d 0bd6 d5c6 90b6 df02 75fd  ..............u.
	0x0020:  5010 18e4 fe1c 0000                      P.......
16:05:11.254211 IP (tos 0x0, ttl 64, id 0, offset 0, flags [DF], proto TCP (6), length 52, bad cksum 0 (->3cc2)!)
    127.0.0.1.3030 > 127.0.0.1.54157: Flags [.], cksum 0xfe28 (incorrect -> 0xe4f5), seq 3741480445, ack 3586560183, win 6370, options [nop,nop,TS val 979109711 ecr 978740223], length 0
	0x0000:  4500 0034 0000 4000 4006 0000 7f00 0001  E..4..@.@.......
	0x0010:  7f00 0001 0bd6 d38d df02 75fd d5c6 90b7  ..........u.....
	0x0020:  8010 18e2 fe28 0000 0101 080a 3a5c 074f  .....(......:\.O
	0x0030:  3a56 63ff                                :Vc.
16:05:12.255061 IP (tos 0x0, ttl 64, id 43584, offset 0, flags [none], proto TCP (6), length 40, bad cksum 0 (->d28d)!)
    127.0.0.1.54157 > 127.0.0.1.3030: Flags [.], cksum 0xfe1c (incorrect -> 0xfe0c), seq 3586560182, ack 3741480445, win 6372, length 0
	0x0000:  4500 0028 aa40 0000 4006 0000 7f00 0001  E..(.@..@.......
	0x0010:  7f00 0001 d38d 0bd6 d5c6 90b6 df02 75fd  ..............u.
	0x0020:  5010 18e4 fe1c 0000                      P.......
16:05:12.255113 IP (tos 0x0, ttl 64, id 0, offset 0, flags [DF], proto TCP (6), length 52, bad cksum 0 (->3cc2)!)
    127.0.0.1.3030 > 127.0.0.1.54157: Flags [.], cksum 0xfe28 (incorrect -> 0xe10d), seq 3741480445, ack 3586560183, win 6370, options [nop,nop,TS val 979110711 ecr 978740223], length 0
	0x0000:  4500 0034 0000 4000 4006 0000 7f00 0001  E..4..@.@.......
	0x0010:  7f00 0001 0bd6 d38d df02 75fd d5c6 90b7  ..........u.....
	0x0020:  8010 18e2 fe28 0000 0101 080a 3a5c 0b37  .....(......:\.7
	0x0030:  3a56 63ff                                :Vc.
16:05:13.755262 IP (tos 0x0, ttl 64, id 9280, offset 0, flags [none], proto TCP (6), length 40, bad cksum 0 (->588e)!)
    127.0.0.1.54157 > 127.0.0.1.3030: Flags [.], cksum 0xfe1c (incorrect -> 0xfe0c), seq 3586560182, ack 3741480445, win 6372, length 0
	0x0000:  4500 0028 2440 0000 4006 0000 7f00 0001  E..($@..@.......
	0x0010:  7f00 0001 d38d 0bd6 d5c6 90b6 df02 75fd  ..............u.
	0x0020:  5010 18e4 fe1c 0000                      P.......
16:05:13.755314 IP (tos 0x0, ttl 64, id 0, offset 0, flags [DF], proto TCP (6), length 52, bad cksum 0 (->3cc2)!)
    127.0.0.1.3030 > 127.0.0.1.54157: Flags [.], cksum 0xfe28 (incorrect -> 0xdb32), seq 3741480445, ack 3586560183, win 6370, options [nop,nop,TS val 979112210 ecr 978740223], length 0
	0x0000:  4500 0034 0000 4000 4006 0000 7f00 0001  E..4..@.@.......
	0x0010:  7f00 0001 0bd6 d38d df02 75fd d5c6 90b7  ..........u.....
	0x0020:  8010 18e2 fe28 0000 0101 080a 3a5c 1112  .....(......:\..
	0x0030:  3a56 63ff                                :Vc.
```

**Comment by Lukasa** [comment]
Hmm, this is useful but I think we need more context. Can you do the following:

1. Stop all your Vapor applications
2. Start them all again, with logging turned on
3. Start tcpdump with port 3030
4. Run _one_ request from postman
5. Post the logs from both vapor applications _and_ the tcpdump logs.

**Comment by saroar** [comment]
```swift
alif@Saroars-MacBook-Pro ~ % sudo tcpdump -i lo0 -nnvvXSs 8000 host 127.0.0.1 and port 3030
tcpdump: listening on lo0, link-type NULL (BSD loopback), capture size 8000 bytes
16:08:06.335232 IP (tos 0x0, ttl 64, id 0, offset 0, flags [DF], proto TCP (6), length 64, bad cksum 0 (->3cb6)!)
    127.0.0.1.56093 > 127.0.0.1.3030: Flags [S], cksum 0xfe34 (incorrect -> 0x5dc2), seq 669297523, win 65535, options [mss 16344,nop,wscale 6,nop,nop,TS val 979283049 ecr 0,sackOK,eol], length 0
	0x0000:  4500 0040 0000 4000 4006 0000 7f00 0001  E..@..@.@.......
	0x0010:  7f00 0001 db1d 0bd6 27e4 ab73 0000 0000  ........'..s....
	0x0020:  b002 ffff fe34 0000 0204 3fd8 0103 0306  .....4....?.....
	0x0030:  0101 080a 3a5e ac69 0000 0000 0402 0000  ....:^.i........
16:08:06.335374 IP (tos 0x0, ttl 64, id 0, offset 0, flags [DF], proto TCP (6), length 64, bad cksum 0 (->3cb6)!)
    127.0.0.1.3030 > 127.0.0.1.56093: Flags [S.], cksum 0xfe34 (incorrect -> 0xa551), seq 134072730, ack 669297524, win 65535, options [mss 16344,nop,wscale 6,nop,nop,TS val 979283049 ecr 979283049,sackOK,eol], length 0
	0x0000:  4500 0040 0000 4000 4006 0000 7f00 0001  E..@..@.@.......
	0x0010:  7f00 0001 0bd6 db1d 07fd c99a 27e4 ab74  ............'..t
	0x0020:  b012 ffff fe34 0000 0204 3fd8 0103 0306  .....4....?.....
	0x0030:  0101 080a 3a5e ac69 3a5e ac69 0402 0000  ....:^.i:^.i....
16:08:06.335405 IP (tos 0x0, ttl 64, id 0, offset 0, flags [DF], proto TCP (6), length 52, bad cksum 0 (->3cc2)!)
    127.0.0.1.56093 > 127.0.0.1.3030: Flags [.], cksum 0xfe28 (incorrect -> 0x065b), seq 669297524, ack 134072731, win 6379, options [nop,nop,TS val 979283049 ecr 979283049], length 0
	0x0000:  4500 0034 0000 4000 4006 0000 7f00 0001  E..4..@.@.......
	0x0010:  7f00 0001 db1d 0bd6 27e4 ab74 07fd c99b  ........'..t....
	0x0020:  8010 18eb fe28 0000 0101 080a 3a5e ac69  .....(......:^.i
	0x0030:  3a5e ac69                                :^.i
16:08:06.335433 IP (tos 0x0, ttl 64, id 0, offset 0, flags [DF], proto TCP (6), length 52, bad cksum 0 (->3cc2)!)
    127.0.0.1.3030 > 127.0.0.1.56093: Flags [.], cksum 0xfe28 (incorrect -> 0x065b), seq 134072731, ack 669297524, win 6379, options [nop,nop,TS val 979283049 ecr 979283049], length 0
	0x0000:  4500 0034 0000 4000 4006 0000 7f00 0001  E..4..@.@.......
	0x0010:  7f00 0001 0bd6 db1d 07fd c99b 27e4 ab74  ............'..t
	0x0020:  8010 18eb fe28 0000 0101 080a 3a5e ac69  .....(......:^.i
	0x0030:  3a5e ac69                                :^.i
```

**Comment by saroar** [comment]
```
[ codes.vapor.application ] [ TRACE ] Decoded HTTP part: head: HTTPRequestHead { method: POST, uri: "/v1/auth/login", version: HTTP/1.1, headers: [("Content-Type", "application/json"), ("User-Agent", "PostmanRuntime/7.26.8"), ("Accept", "*/*"), ("Postman-Token", "7d34898d-e8ce-45cf-a2fe-95e5622fc6b8"), ("Host", "localhost:8080"), ("Accept-Encoding", "gzip, deflate, br"), ("Connection", "keep-alive"), ("Content-Length", "37")] } (Vapor/HTTP/Server/HTTPServerRequestDecoder.swift:34)
[ codes.vapor.application ] [ TRACE ] Decoded HTTP part: body: ByteBuffer { readerIndex: 0, writerIndex: 37, readableBytes: 37, capacity: 37, storageCapacity: 2048, slice: _ByteBufferSlice { 267..<304 }, storage: 0x0000000109808a00 (2048 bytes) } (Vapor/HTTP/Server/HTTPServerRequestDecoder.swift:34)
[ codes.vapor.application ] [ TRACE ] Decoded HTTP part: end (Vapor/HTTP/Server/HTTPServerRequestDecoder.swift:34)
[ codes.vapor.application ] [ INFO ] POST /v1/auth/login [request-id: 972034F1-C68C-4F1D-87B5-8789F2B577DE] (Vapor/Responder/DefaultResponder.swift:42)
[ codes.vapor.application ] [ TRACE ] selected EventLoop for task given the preference [ahc-el-preference: delegate(on: SelectableEventLoop { selector = Selector { descriptor = 9 }, thread = NIOThread(name = NIO-ELT-0-#6), scheduledTasks = PriorityQueue(count: 0): [] }), ahc-eventloop: SelectableEventLoop { selector = Selector { descriptor = 9 }, thread = NIOThread(name = NIO-ELT-0-#6) }, ahc-request-id: 0] (AsyncHTTPClient/HTTPClient.swift:503)
[ codes.vapor.application ] [ TRACE ] opening fresh connection (no connections to reuse available) [ahc-request-id: 0] (AsyncHTTPClient/ConnectionPool.swift:243)
[ codes.vapor.application ] [ TRACE ] successfully created connection [ahc-connection: SocketChannel { BaseSocket { fd=14 }, active = true, localAddress = Optional([IPv4]127.0.0.1/127.0.0.1:56202), remoteAddress = Optional([IPv4]127.0.0.1/127.0.0.1:3030) }, ahc-request-id: 0] (AsyncHTTPClient/ConnectionPool.swift:315)
[ codes.vapor.application ] [ DEBUG ] got connection for request [ahc-channel-el: SelectableEventLoop { selector = Selector { descriptor = 9 }, thread = NIOThread(name = NIO-ELT-0-#6) }, ahc-connection: SocketChannel { BaseSocket { fd=14 }, active = true, localAddress = Optional([IPv4]127.0.0.1/127.0.0.1:56202), remoteAddress = Optional([IPv4]127.0.0.1/127.0.0.1:3030) }, ahc-request: POST http://0.0.0.0:3030/v1/auth/login, ahc-request-id: 0, ahc-task-el: SelectableEventLoop { selector = Selector { descriptor = 9 }, thread = NIOThread(name = NIO-ELT-0-#6) }] (AsyncHTTPClient/HTTPClient.swift:557)
[ codes.vapor.application ] [ DEBUG ] Unhandled HTTP server error: invalid HTTP method (Vapor/HTTP/Server/HTTPServer.swift:421)
[ codes.vapor.application ] [ TRACE ] Unhandled user event: outputClosed (Vapor/HTTP/Server/HTTPServerRequestDecoder.swift:212)
[ codes.vapor.application ] [ DEBUG ] Unhandled HTTP server error: invalid HTTP method (Vapor/HTTP/Server/HTTPServer.swift:421)
[ codes.vapor.application ] [ TRACE ] Unhandled user event: outputClosed (Vapor/HTTP/Server/HTTPServerRequestDecoder.swift:212)
[ codes.vapor.application ] [ DEBUG ] Unhandled HTTP server error: invalid HTTP method (Vapor/HTTP/Server/HTTPServer.swift:421)
[ codes.vapor.application ] [ TRACE ] Unhandled user event: outputClosed (Vapor/HTTP/Server/HTTPServerRequestDecoder.swift:212)
```
`alif@Saroars-MacBook-Pro ~ % sudo tcpdump -i lo0 -nnvvXSs 8000 host 127.0.0.1 and port 8080`
```
tcpdump: listening on lo0, link-type NULL (BSD loopback), capture size 8000 bytes
16:10:20.162754 IP (tos 0x0, ttl 64, id 0, offset 0, flags [DF], proto TCP (6), length 64, bad cksum 0 (->3cb6)!)
    127.0.0.1.56201 > 127.0.0.1.8080: Flags [S], cksum 0xfe34 (incorrect -> 0x1722), seq 4259053966, win 65535, options [mss 16344,nop,wscale 6,nop,nop,TS val 979415758 ecr 0,sackOK,eol], length 0
	0x0000:  4500 0040 0000 4000 4006 0000 7f00 0001  E..@..@.@.......
	0x0010:  7f00 0001 db89 1f90 fddc 018e 0000 0000  ................
	0x0020:  b002 ffff fe34 0000 0204 3fd8 0103 0306  .....4....?.....
	0x0030:  0101 080a 3a60 b2ce 0000 0000 0402 0000  ....:`..........
16:10:20.162879 IP (tos 0x0, ttl 64, id 0, offset 0, flags [DF], proto TCP (6), length 64, bad cksum 0 (->3cb6)!)
    127.0.0.1.8080 > 127.0.0.1.56201: Flags [S.], cksum 0xfe34 (incorrect -> 0x9735), seq 845111373, ack 4259053967, win 65535, options [mss 16344,nop,wscale 6,nop,nop,TS val 979415758 ecr 979415758,sackOK,eol], length 0
	0x0000:  4500 0040 0000 4000 4006 0000 7f00 0001  E..@..@.@.......
	0x0010:  7f00 0001 1f90 db89 325f 604d fddc 018f  ........2_`M....
	0x0020:  b012 ffff fe34 0000 0204 3fd8 0103 0306  .....4....?.....
	0x0030:  0101 080a 3a60 b2ce 3a60 b2ce 0402 0000  ....:`..:`......
16:10:20.162900 IP (tos 0x0, ttl 64, id 0, offset 0, flags [DF], proto TCP (6), length 52, bad cksum 0 (->3cc2)!)
    127.0.0.1.56201 > 127.0.0.1.8080: Flags [.], cksum 0xfe28 (incorrect -> 0xf83e), seq 4259053967, ack 845111374, win 6379, options [nop,nop,TS val 979415758 ecr 979415758], length 0
	0x0000:  4500 0034 0000 4000 4006 0000 7f00 0001  E..4..@.@.......
	0x0010:  7f00 0001 db89 1f90 fddc 018f 325f 604e  ............2_`N
	0x0020:  8010 18eb fe28 0000 0101 080a 3a60 b2ce  .....(......:`..
	0x0030:  3a60 b2ce                                :`..
16:10:20.162916 IP (tos 0x0, ttl 64, id 0, offset 0, flags [DF], proto TCP (6), length 52, bad cksum 0 (->3cc2)!)
    127.0.0.1.8080 > 127.0.0.1.56201: Flags [.], cksum 0xfe28 (incorrect -> 0xf83e), seq 845111374, ack 4259053967, win 6379, options [nop,nop,TS val 979415758 ecr 979415758], length 0
	0x0000:  4500 0034 0000 4000 4006 0000 7f00 0001  E..4..@.@.......
	0x0010:  7f00 0001 1f90 db89 325f 604e fddc 018f  ........2_`N....
	0x0020:  8010 18eb fe28 0000 0101 080a 3a60 b2ce  .....(......:`..
	0x0030:  3a60 b2ce                                :`..
16:10:20.163091 IP (tos 0x0, ttl 64, id 0, offset 0, flags [DF], proto TCP (6), length 356, bad cksum 0 (->3b92)!)
    127.0.0.1.56201 > 127.0.0.1.8080: Flags [P.], cksum 0xff58 (incorrect -> 0xa0b0), seq 4259053967:4259054271, ack 845111374, win 6379, options [nop,nop,TS val 979415758 ecr 979415758], length 304: HTTP, length: 304
	POST /v1/auth/login HTTP/1.1
	Content-Type: application/json
	User-Agent: PostmanRuntime/7.26.8
	Accept: */*
	Postman-Token: 7d34898d-e8ce-45cf-a2fe-95e5622fc6b8
	Host: localhost:8080
	Accept-Encoding: gzip, deflate, br
	Connection: keep-alive
	Content-Length: 37

	{
	    "phoneNumber": "+79218821219"
	}[!http]
	0x0000:  4500 0164 0000 4000 4006 0000 7f00 0001  E..d..@.@.......
	0x0010:  7f00 0001 db89 1f90 fddc 018f 325f 604e  ............2_`N
	0x0020:  8018 18eb ff58 0000 0101 080a 3a60 b2ce  .....X......:`..
	0x0030:  3a60 b2ce 504f 5354 202f 7631 2f61 7574  :`..POST./v1/aut
	0x0040:  682f 6c6f 6769 6e20 4854 5450 2f31 2e31  h/login.HTTP/1.1
	0x0050:  0d0a 436f 6e74 656e 742d 5479 7065 3a20  ..Content-Type:.
	0x0060:  6170 706c 6963 6174 696f 6e2f 6a73 6f6e  application/json
	0x0070:  0d0a 5573 6572 2d41 6765 6e74 3a20 506f  ..User-Agent:.Po
	0x0080:  7374 6d61 6e52 756e 7469 6d65 2f37 2e32  stmanRuntime/7.2
	0x0090:  362e 380d 0a41 6363 6570 743a 202a 2f2a  6.8..Accept:.*/*
	0x00a0:  0d0a 506f 7374 6d61 6e2d 546f 6b65 6e3a  ..Postman-Token:
	0x00b0:  2037 6433 3438 3938 642d 6538 6365 2d34  .7d34898d-e8ce-4
	0x00c0:  3563 662d 6132 6665 2d39 3565 3536 3232  5cf-a2fe-95e5622
	0x00d0:  6663 3662 380d 0a48 6f73 743a 206c 6f63  fc6b8..Host:.loc
	0x00e0:  616c 686f 7374 3a38 3038 300d 0a41 6363  alhost:8080..Acc
	0x00f0:  6570 742d 456e 636f 6469 6e67 3a20 677a  ept-Encoding:.gz
	0x0100:  6970 2c20 6465 666c 6174 652c 2062 720d  ip,.deflate,.br.
	0x0110:  0a43 6f6e 6e65 6374 696f 6e3a 206b 6565  .Connection:.kee
	0x0120:  702d 616c 6976 650d 0a43 6f6e 7465 6e74  p-alive..Content
	0x0130:  2d4c 656e 6774 683a 2033 370d 0a0d 0a7b  -Length:.37....{
	0x0140:  0a20 2020 2022 7068 6f6e 654e 756d 6265  ....."phoneNumbe
	0x0150:  7222 3a20 222b 3739 3231 3838 3231 3231  r":."+7921882121
	0x0160:  3922 0a7d                                9".}
16:10:20.163128 IP (tos 0x0, ttl 64, id 0, offset 0, flags [DF], proto TCP (6), length 52, bad cksum 0 (->3cc2)!)
    127.0.0.1.8080 > 127.0.0.1.56201: Flags [.], cksum 0xfe28 (incorrect -> 0xf713), seq 845111374, ack 4259054271, win 6374, options [nop,nop,TS val 979415758 ecr 979415758], length 0
	0x0000:  4500 0034 0000 4000 4006 0000 7f00 0001  E..4..@.@.......
	0x0010:  7f00 0001 1f90 db89 325f 604e fddc 02bf  ........2_`N....
	0x0020:  8010 18e6 fe28 0000 0101 080a 3a60 b2ce  .....(......:`..
	0x0030:  3a60 b2ce                                :`..
16:10:37.940574 IP (tos 0x0, ttl 64, id 0, offset 0, flags [DF], proto TCP (6), length 64, bad cksum 0 (->3cb6)!)
    127.0.0.1.56215 > 127.0.0.1.8080: Flags [S], cksum 0xfe34 (incorrect -> 0xe629), seq 2046521702, win 65535, options [mss 16344,nop,wscale 6,nop,nop,TS val 979433409 ecr 0,sackOK,eol], length 0
	0x0000:  4500 0040 0000 4000 4006 0000 7f00 0001  E..@..@.@.......
	0x0010:  7f00 0001 db97 1f90 79fb 7166 0000 0000  ........y.qf....
	0x0020:  b002 ffff fe34 0000 0204 3fd8 0103 0306  .....4....?.....
	0x0030:  0101 080a 3a60 f7c1 0000 0000 0402 0000  ....:`..........
16:10:37.940680 IP (tos 0x0, ttl 64, id 0, offset 0, flags [DF], proto TCP (6), length 64, bad cksum 0 (->3cb6)!)
    127.0.0.1.8080 > 127.0.0.1.56215: Flags [S.], cksum 0xfe34 (incorrect -> 0xd74e), seq 2045076162, ack 2046521703, win 65535, options [mss 16344,nop,wscale 6,nop,nop,TS val 979433409 ecr 979433409,sackOK,eol], length 0
	0x0000:  4500 0040 0000 4000 4006 0000 7f00 0001  E..@..@.@.......
	0x0010:  7f00 0001 1f90 db97 79e5 62c2 79fb 7167  ........y.b.y.qg
	0x0020:  b012 ffff fe34 0000 0204 3fd8 0103 0306  .....4....?.....
	0x0030:  0101 080a 3a60 f7c1 3a60 f7c1 0402 0000  ....:`..:`......
16:10:37.940702 IP (tos 0x0, ttl 64, id 0, offset 0, flags [DF], proto TCP (6), length 52, bad cksum 0 (->3cc2)!)
    127.0.0.1.56215 > 127.0.0.1.8080: Flags [.], cksum 0xfe28 (incorrect -> 0x3858), seq 2046521703, ack 2045076163, win 6379, options [nop,nop,TS val 979433409 ecr 979433409], length 0
	0x0000:  4500 0034 0000 4000 4006 0000 7f00 0001  E..4..@.@.......
	0x0010:  7f00 0001 db97 1f90 79fb 7167 79e5 62c3  ........y.qgy.b.
	0x0020:  8010 18eb fe28 0000 0101 080a 3a60 f7c1  .....(......:`..
	0x0030:  3a60 f7c1                                :`..
16:10:37.940725 IP (tos 0x0, ttl 64, id 0, offset 0, flags [DF], proto TCP (6), length 52, bad cksum 0 (->3cc2)!)
    127.0.0.1.8080 > 127.0.0.1.56215: Flags [.], cksum 0xfe28 (incorrect -> 0x3858), seq 2045076163, ack 2046521703, win 6379, options [nop,nop,TS val 979433409 ecr 979433409], length 0
	0x0000:  4500 0034 0000 4000 4006 0000 7f00 0001  E..4..@.@.......
	0x0010:  7f00 0001 1f90 db97 79e5 62c3 79fb 7167  ........y.b.y.qg
	0x0020:  8010 18eb fe28 0000 0101 080a 3a60 f7c1  .....(......:`..
	0x0030:  3a60 f7c1                                :`..
16:10:37.969983 IP (tos 0x0, ttl 64, id 0, offset 0, flags [DF], proto TCP (6), length 569, bad cksum 0 (->3abd)!)
    127.0.0.1.56215 > 127.0.0.1.8080: Flags [P.], cksum 0x002e (incorrect -> 0x3655), seq 2046521703:2046522220, ack 2045076163, win 6379, options [nop,nop,TS val 979433435 ecr 979433409], length 517: HTTP
	0x0000:  4500 0239 0000 4000 4006 0000 7f00 0001  E..9..@.@.......
	0x0010:  7f00 0001 db97 1f90 79fb 7167 79e5 62c3  ........y.qgy.b.
	0x0020:  8018 18eb 002e 0000 0101 080a 3a60 f7db  ............:`..
	0x0030:  3a60 f7c1 1603 0102 0001 0001 fc03 0398  :`..............
	0x0040:  a573 1948 69e7 409e 2df1 903d ca91 bade  .s.Hi.@.-..=....
	0x0050:  5282 f6fa 96f8 e9f8 9823 d2d1 7573 6220  R........#..usb.
	0x0060:  7a95 7f72 dcdd 6889 448c 1dfa a995 67f9  z..r..h.D.....g.
	0x0070:  b9d7 ee9b 15f2 b98e 5a00 b245 6a8d 782c  ........Z..Ej.x,
	0x0080:  0026 8a8a 1301 1302 1303 c02b c02f c02c  .&.........+./.,
	0x0090:  c030 cca9 cca8 c009 c013 c00a c014 009c  .0..............
	0x00a0:  009d 002f 0035 000a 0100 018d baba 0000  .../.5..........
	0x00b0:  0017 0000 ff01 0001 0000 0a00 0a00 086a  ...............j
	0x00c0:  6a00 1d00 1700 1800 0b00 0201 0000 2300  j.............#.
	0x00d0:  0000 1000 0e00 0c02 6832 0868 7474 702f  ........h2.http/
	0x00e0:  312e 3100 0500 0501 0000 0000 000d 0014  1.1.............
	0x00f0:  0012 0403 0804 0401 0503 0805 0501 0806  ................
	0x0100:  0601 0201 0012 0000 0033 002b 0029 6a6a  .........3.+.)jj
	0x0110:  0001 0000 1d00 20a3 f8e9 0eff 9e1b 356d  ..............5m
	0x0120:  2673 5489 087a a2be 161f 63b1 e383 9c58  &sT..z....c....X
	0x0130:  5b04 521c d78d 5000 2d00 0201 0100 2b00  [.R...P.-.....+.
	0x0140:  0b0a 4a4a 0304 0303 0302 0301 aaaa 0001  ..JJ............
	0x0150:  0000 1500 e400 0000 0000 0000 0000 0000  ................
	0x0160:  0000 0000 0000 0000 0000 0000 0000 0000  ................
	0x0170:  0000 0000 0000 0000 0000 0000 0000 0000  ................
	0x0180:  0000 0000 0000 0000 0000 0000 0000 0000  ................
	0x0190:  0000 0000 0000 0000 0000 0000 0000 0000  ................
	0x01a0:  0000 0000 0000 0000 0000 0000 0000 0000  ................
	0x01b0:  0000 0000 0000 0000 0000 0000 0000 0000  ................
	0x01c0:  0000 0000 0000 0000 0000 0000 0000 0000  ................
	0x01d0:  0000 0000 0000 0000 0000 0000 0000 0000  ................
	0x01e0:  0000 0000 0000 0000 0000 0000 0000 0000  ................
	0x01f0:  0000 0000 0000 0000 0000 0000 0000 0000  ................
	0x0200:  0000 0000 0000 0000 0000 0000 0000 0000  ................
	0x0210:  0000 0000 0000 0000 0000 0000 0000 0000  ................
	0x0220:  0000 0000 0000 0000 0000 0000 0000 0000  ................
	0x0230:  0000 0000 0000 0000 00                   .........
16:10:37.970019 IP (tos 0x0, ttl 64, id 0, offset 0, flags [DF], proto TCP (6), length 52, bad cksum 0 (->3cc2)!)
    127.0.0.1.8080 > 127.0.0.1.56215: Flags [.], cksum 0xfe28 (incorrect -> 0x3627), seq 2045076163, ack 2046522220, win 6371, options [nop,nop,TS val 979433435 ecr 979433435], length 0
	0x0000:  4500 0034 0000 4000 4006 0000 7f00 0001  E..4..@.@.......
	0x0010:  7f00 0001 1f90 db97 79e5 62c3 79fb 736c  ........y.b.y.sl
	0x0020:  8010 18e3 fe28 0000 0101 080a 3a60 f7db  .....(......:`..
	0x0030:  3a60 f7db                                :`..
16:10:37.971546 IP (tos 0x0, ttl 64, id 0, offset 0, flags [DF], proto TCP (6), length 52, bad cksum 0 (->3cc2)!)
    127.0.0.1.8080 > 127.0.0.1.56215: Flags [F.], cksum 0xfe28 (incorrect -> 0x3624), seq 2045076163, ack 2046522220, win 6371, options [nop,nop,TS val 979433437 ecr 979433435], length 0
	0x0000:  4500 0034 0000 4000 4006 0000 7f00 0001  E..4..@.@.......
	0x0010:  7f00 0001 1f90 db97 79e5 62c3 79fb 736c  ........y.b.y.sl
	0x0020:  8011 18e3 fe28 0000 0101 080a 3a60 f7dd  .....(......:`..
	0x0030:  3a60 f7db                                :`..
16:10:37.971576 IP (tos 0x0, ttl 64, id 0, offset 0, flags [DF], proto TCP (6), length 52, bad cksum 0 (->3cc2)!)
    127.0.0.1.56215 > 127.0.0.1.8080: Flags [.], cksum 0xfe28 (incorrect -> 0x361a), seq 2046522220, ack 2045076164, win 6379, options [nop,nop,TS val 979433437 ecr 979433437], length 0
	0x0000:  4500 0034 0000 4000 4006 0000 7f00 0001  E..4..@.@.......
	0x0010:  7f00 0001 db97 1f90 79fb 736c 79e5 62c4  ........y.sly.b.
	0x0020:  8010 18eb fe28 0000 0101 080a 3a60 f7dd  .....(......:`..
	0x0030:  3a60 f7dd                                :`..
16:10:37.972162 IP (tos 0x0, ttl 64, id 0, offset 0, flags [DF], proto TCP (6), length 52, bad cksum 0 (->3cc2)!)
    127.0.0.1.56215 > 127.0.0.1.8080: Flags [F.], cksum 0xfe28 (incorrect -> 0x3619), seq 2046522220, ack 2045076164, win 6379, options [nop,nop,TS val 979433437 ecr 979433437], length 0
	0x0000:  4500 0034 0000 4000 4006 0000 7f00 0001  E..4..@.@.......
	0x0010:  7f00 0001 db97 1f90 79fb 736c 79e5 62c4  ........y.sly.b.
	0x0020:  8011 18eb fe28 0000 0101 080a 3a60 f7dd  .....(......:`..
	0x0030:  3a60 f7dd                                :`..
16:10:37.972229 IP (tos 0x0, ttl 64, id 0, offset 0, flags [DF], proto TCP (6), length 52, bad cksum 0 (->3cc2)!)
    127.0.0.1.8080 > 127.0.0.1.56215: Flags [.], cksum 0xfe28 (incorrect -> 0x3621), seq 2045076164, ack 2046522221, win 6371, options [nop,nop,TS val 979433437 ecr 979433437], length 0
	0x0000:  4500 0034 0000 4000 4006 0000 7f00 0001  E..4..@.@.......
	0x0010:  7f00 0001 1f90 db97 79e5 62c4 79fb 736d  ........y.b.y.sm
	0x0020:  8010 18e3 fe28 0000 0101 080a 3a60 f7dd  .....(......:`..
	0x0030:  3a60 f7dd                                :`..
16:10:37.980333 IP (tos 0x0, ttl 64, id 0, offset 0, flags [DF], proto TCP (6), length 64, bad cksum 0 (->3cb6)!)
    127.0.0.1.56223 > 127.0.0.1.8080: Flags [S], cksum 0xfe34 (incorrect -> 0xcbfe), seq 4011005517, win 65535, options [mss 16344,nop,wscale 6,nop,nop,TS val 979433445 ecr 0,sackOK,eol], length 0
	0x0000:  4500 0040 0000 4000 4006 0000 7f00 0001  E..@..@.@.......
	0x0010:  7f00 0001 db9f 1f90 ef13 164d 0000 0000  ...........M....
	0x0020:  b002 ffff fe34 0000 0204 3fd8 0103 0306  .....4....?.....
	0x0030:  0101 080a 3a60 f7e5 0000 0000 0402 0000  ....:`..........
16:10:37.980447 IP (tos 0x0, ttl 64, id 0, offset 0, flags [DF], proto TCP (6), length 64, bad cksum 0 (->3cb6)!)
    127.0.0.1.8080 > 127.0.0.1.56223: Flags [S.], cksum 0xfe34 (incorrect -> 0x9fb9), seq 3342545586, ack 4011005518, win 65535, options [mss 16344,nop,wscale 6,nop,nop,TS val 979433445 ecr 979433445,sackOK,eol], length 0
	0x0000:  4500 0040 0000 4000 4006 0000 7f00 0001  E..@..@.@.......
	0x0010:  7f00 0001 1f90 db9f c73b 32b2 ef13 164e  .........;2....N
	0x0020:  b012 ffff fe34 0000 0204 3fd8 0103 0306  .....4....?.....
	0x0030:  0101 080a 3a60 f7e5 3a60 f7e5 0402 0000  ....:`..:`......
16:10:37.980467 IP (tos 0x0, ttl 64, id 0, offset 0, flags [DF], proto TCP (6), length 52, bad cksum 0 (->3cc2)!)
    127.0.0.1.56223 > 127.0.0.1.8080: Flags [.], cksum 0xfe28 (incorrect -> 0x00c3), seq 4011005518, ack 3342545587, win 6379, options [nop,nop,TS val 979433445 ecr 979433445], length 0
	0x0000:  4500 0034 0000 4000 4006 0000 7f00 0001  E..4..@.@.......
	0x0010:  7f00 0001 db9f 1f90 ef13 164e c73b 32b3  ...........N.;2.
	0x0020:  8010 18eb fe28 0000 0101 080a 3a60 f7e5  .....(......:`..
	0x0030:  3a60 f7e5                                :`..
16:10:37.980489 IP (tos 0x0, ttl 64, id 0, offset 0, flags [DF], proto TCP (6), length 52, bad cksum 0 (->3cc2)!)
    127.0.0.1.8080 > 127.0.0.1.56223: Flags [.], cksum 0xfe28 (incorrect -> 0x00c3), seq 3342545587, ack 4011005518, win 6379, options [nop,nop,TS val 979433445 ecr 979433445], length 0
	0x0000:  4500 0034 0000 4000 4006 0000 7f00 0001  E..4..@.@.......
	0x0010:  7f00 0001 1f90 db9f c73b 32b3 ef13 164e  .........;2....N
	0x0020:  8010 18eb fe28 0000 0101 080a 3a60 f7e5  .....(......:`..
	0x0030:  3a60 f7e5                                :`..
16:10:37.982608 IP (tos 0x0, ttl 64, id 0, offset 0, flags [DF], proto TCP (6), length 569, bad cksum 0 (->3abd)!)
    127.0.0.1.56223 > 127.0.0.1.8080: Flags [P.], cksum 0x002e (incorrect -> 0xe24b), seq 4011005518:4011006035, ack 3342545587, win 6379, options [nop,nop,TS val 979433447 ecr 979433445], length 517: HTTP
	0x0000:  4500 0239 0000 4000 4006 0000 7f00 0001  E..9..@.@.......
	0x0010:  7f00 0001 db9f 1f90 ef13 164e c73b 32b3  ...........N.;2.
	0x0020:  8018 18eb 002e 0000 0101 080a 3a60 f7e7  ............:`..
	0x0030:  3a60 f7e5 1603 0102 0001 0001 fc03 03f6  :`..............
	0x0040:  9f0a e054 6b18 8b47 18a0 cefc b5a1 2b90  ...Tk..G......+.
	0x0050:  b117 665e a56b 522a 47cf ac9b aaf3 7620  ..f^.kR*G.....v.
	0x0060:  ec9a f9bb ed98 fb45 92c2 cdbe 13ef 171e  .......E........
	0x0070:  93d1 6e6a 2b9f 6ee3 9742 365c 1335 7dcd  ..nj+.n..B6\.5}.
	0x0080:  0026 aaaa 1301 1302 1303 c02b c02f c02c  .&.........+./.,
	0x0090:  c030 cca9 cca8 c009 c013 c00a c014 009c  .0..............
	0x00a0:  009d 002f 0035 000a 0100 018d 4a4a 0000  .../.5......JJ..
	0x00b0:  0017 0000 ff01 0001 0000 0a00 0a00 088a  ................
	0x00c0:  8a00 1d00 1700 1800 0b00 0201 0000 2300  ..............#.
	0x00d0:  0000 1000 0e00 0c02 6832 0868 7474 702f  ........h2.http/
	0x00e0:  312e 3100 0500 0501 0000 0000 000d 0014  1.1.............
	0x00f0:  0012 0403 0804 0401 0503 0805 0501 0806  ................
	0x0100:  0601 0201 0012 0000 0033 002b 0029 8a8a  .........3.+.)..
	0x0110:  0001 0000 1d00 200c 4d0c afb0 87bc 1463  ........M......c
	0x0120:  843e 7119 d552 62c2 49b5 b084 db03 3e3e  .>q..Rb.I.....>>
	0x0130:  556d 96e6 6c61 7500 2d00 0201 0100 2b00  Um..lau.-.....+.
	0x0140:  0b0a 6a6a 0304 0303 0302 0301 fafa 0001  ..jj............
	0x0150:  0000 1500 e400 0000 0000 0000 0000 0000  ................
	0x0160:  0000 0000 0000 0000 0000 0000 0000 0000  ................
	0x0170:  0000 0000 0000 0000 0000 0000 0000 0000  ................
	0x0180:  0000 0000 0000 0000 0000 0000 0000 0000  ................
	0x0190:  0000 0000 0000 0000 0000 0000 0000 0000  ................
	0x01a0:  0000 0000 0000 0000 0000 0000 0000 0000  ................
	0x01b0:  0000 0000 0000 0000 0000 0000 0000 0000  ................
	0x01c0:  0000 0000 0000 0000 0000 0000 0000 0000  ................
	0x01d0:  0000 0000 0000 0000 0000 0000 0000 0000  ................
	0x01e0:  0000 0000 0000 0000 0000 0000 0000 0000  ................
	0x01f0:  0000 0000 0000 0000 0000 0000 0000 0000  ................
	0x0200:  0000 0000 0000 0000 0000 0000 0000 0000  ................
	0x0210:  0000 0000 0000 0000 0000 0000 0000 0000  ................
	0x0220:  0000 0000 0000 0000 0000 0000 0000 0000  ................
	0x0230:  0000 0000 0000 0000 00                   .........
16:10:37.982648 IP (tos 0x0, ttl 64, id 0, offset 0, flags [DF], proto TCP (6), length 52, bad cksum 0 (->3cc2)!)
    127.0.0.1.8080 > 127.0.0.1.56223: Flags [.], cksum 0xfe28 (incorrect -> 0xfec1), seq 3342545587, ack 4011006035, win 6371, options [nop,nop,TS val 979433447 ecr 979433447], length 0
	0x0000:  4500 0034 0000 4000 4006 0000 7f00 0001  E..4..@.@.......
	0x0010:  7f00 0001 1f90 db9f c73b 32b3 ef13 1853  .........;2....S
	0x0020:  8010 18e3 fe28 0000 0101 080a 3a60 f7e7  .....(......:`..
	0x0030:  3a60 f7e7                                :`..
16:10:37.983812 IP (tos 0x0, ttl 64, id 0, offset 0, flags [DF], proto TCP (6), length 52, bad cksum 0 (->3cc2)!)
    127.0.0.1.8080 > 127.0.0.1.56223: Flags [F.], cksum 0xfe28 (incorrect -> 0xfebf), seq 3342545587, ack 4011006035, win 6371, options [nop,nop,TS val 979433448 ecr 979433447], length 0
	0x0000:  4500 0034 0000 4000 4006 0000 7f00 0001  E..4..@.@.......
	0x0010:  7f00 0001 1f90 db9f c73b 32b3 ef13 1853  .........;2....S
	0x0020:  8011 18e3 fe28 0000 0101 080a 3a60 f7e8  .....(......:`..
	0x0030:  3a60 f7e7                                :`..
16:10:37.983876 IP (tos 0x0, ttl 64, id 0, offset 0, flags [DF], proto TCP (6), length 52, bad cksum 0 (->3cc2)!)
    127.0.0.1.56223 > 127.0.0.1.8080: Flags [.], cksum 0xfe28 (incorrect -> 0xfeb6), seq 4011006035, ack 3342545588, win 6379, options [nop,nop,TS val 979433448 ecr 979433448], length 0
	0x0000:  4500 0034 0000 4000 4006 0000 7f00 0001  E..4..@.@.......
	0x0010:  7f00 0001 db9f 1f90 ef13 1853 c73b 32b4  ...........S.;2.
	0x0020:  8010 18eb fe28 0000 0101 080a 3a60 f7e8  .....(......:`..
	0x0030:  3a60 f7e8                                :`..
16:10:37.986120 IP (tos 0x0, ttl 64, id 0, offset 0, flags [DF], proto TCP (6), length 52, bad cksum 0 (->3cc2)!)
    127.0.0.1.56223 > 127.0.0.1.8080: Flags [F.], cksum 0xfe28 (incorrect -> 0xfeb3), seq 4011006035, ack 3342545588, win 6379, options [nop,nop,TS val 979433450 ecr 979433448], length 0
	0x0000:  4500 0034 0000 4000 4006 0000 7f00 0001  E..4..@.@.......
	0x0010:  7f00 0001 db9f 1f90 ef13 1853 c73b 32b4  ...........S.;2.
	0x0020:  8011 18eb fe28 0000 0101 080a 3a60 f7ea  .....(......:`..
	0x0030:  3a60 f7e8                                :`..
16:10:37.986202 IP (tos 0x0, ttl 64, id 0, offset 0, flags [DF], proto TCP (6), length 52, bad cksum 0 (->3cc2)!)
    127.0.0.1.8080 > 127.0.0.1.56223: Flags [.], cksum 0xfe28 (incorrect -> 0xfeb9), seq 3342545588, ack 4011006036, win 6371, options [nop,nop,TS val 979433450 ecr 979433450], length 0
	0x0000:  4500 0034 0000 4000 4006 0000 7f00 0001  E..4..@.@.......
	0x0010:  7f00 0001 1f90 db9f c73b 32b4 ef13 1854  .........;2....T
	0x0020:  8010 18e3 fe28 0000 0101 080a 3a60 f7ea  .....(......:`..
	0x0030:  3a60 f7ea                                :`..
16:10:37.996113 IP (tos 0x0, ttl 64, id 0, offset 0, flags [DF], proto TCP (6), length 64, bad cksum 0 (->3cb6)!)
    127.0.0.1.56224 > 127.0.0.1.8080: Flags [S], cksum 0xfe34 (incorrect -> 0x1f73), seq 604147163, win 65535, options [mss 16344,nop,wscale 6,nop,nop,TS val 979433459 ecr 0,sackOK,eol], length 0
	0x0000:  4500 0040 0000 4000 4006 0000 7f00 0001  E..@..@.@.......
	0x0010:  7f00 0001 dba0 1f90 2402 8ddb 0000 0000  ........$.......
	0x0020:  b002 ffff fe34 0000 0204 3fd8 0103 0306  .....4....?.....
	0x0030:  0101 080a 3a60 f7f3 0000 0000 0402 0000  ....:`..........
16:10:37.996280 IP (tos 0x0, ttl 64, id 0, offset 0, flags [DF], proto TCP (6), length 64, bad cksum 0 (->3cb6)!)
    127.0.0.1.8080 > 127.0.0.1.56224: Flags [S.], cksum 0xfe34 (incorrect -> 0x9700), seq 2526461814, ack 604147164, win 65535, options [mss 16344,nop,wscale 6,nop,nop,TS val 979433459 ecr 979433459,sackOK,eol], length 0
	0x0000:  4500 0040 0000 4000 4006 0000 7f00 0001  E..@..@.@.......
	0x0010:  7f00 0001 1f90 dba0 9696 bf76 2402 8ddc  ...........v$...
	0x0020:  b012 ffff fe34 0000 0204 3fd8 0103 0306  .....4....?.....
	0x0030:  0101 080a 3a60 f7f3 3a60 f7f3 0402 0000  ....:`..:`......
16:10:37.996305 IP (tos 0x0, ttl 64, id 0, offset 0, flags [DF], proto TCP (6), length 52, bad cksum 0 (->3cc2)!)
    127.0.0.1.56224 > 127.0.0.1.8080: Flags [.], cksum 0xfe28 (incorrect -> 0xf809), seq 604147164, ack 2526461815, win 6379, options [nop,nop,TS val 979433459 ecr 979433459], length 0
	0x0000:  4500 0034 0000 4000 4006 0000 7f00 0001  E..4..@.@.......
	0x0010:  7f00 0001 dba0 1f90 2402 8ddc 9696 bf77  ........$......w
	0x0020:  8010 18eb fe28 0000 0101 080a 3a60 f7f3  .....(......:`..
	0x0030:  3a60 f7f3                                :`..
16:10:37.996327 IP (tos 0x0, ttl 64, id 0, offset 0, flags [DF], proto TCP (6), length 52, bad cksum 0 (->3cc2)!)
    127.0.0.1.8080 > 127.0.0.1.56224: Flags [.], cksum 0xfe28 (incorrect -> 0xf809), seq 2526461815, ack 604147164, win 6379, options [nop,nop,TS val 979433459 ecr 979433459], length 0
	0x0000:  4500 0034 0000 4000 4006 0000 7f00 0001  E..4..@.@.......
	0x0010:  7f00 0001 1f90 dba0 9696 bf77 2402 8ddc  ...........w$...
	0x0020:  8010 18eb fe28 0000 0101 080a 3a60 f7f3  .....(......:`..
	0x0030:  3a60 f7f3                                :`..
16:10:37.997994 IP (tos 0x0, ttl 64, id 0, offset 0, flags [DF], proto TCP (6), length 178, bad cksum 0 (->3c44)!)
    127.0.0.1.56224 > 127.0.0.1.8080: Flags [P.], cksum 0xfea6 (incorrect -> 0xd0b8), seq 604147164:604147290, ack 2526461815, win 6379, options [nop,nop,TS val 979433461 ecr 979433459], length 126: HTTP
	0x0000:  4500 00b2 0000 4000 4006 0000 7f00 0001  E.....@.@.......
	0x0010:  7f00 0001 dba0 1f90 2402 8ddc 9696 bf77  ........$......w
	0x0020:  8018 18eb fea6 0000 0101 080a 3a60 f7f5  ............:`..
	0x0030:  3a60 f7f3 1603 0100 7901 0000 7503 0115  :`......y...u...
	0x0040:  af77 cfa2 00b5 a285 c5ff 1693 9547 0ffe  .w...........G..
	0x0050:  f757 9b73 456a 0f9f 2002 15b2 fa5f e400  .W.sEj......._..
	0x0060:  000e c009 c013 c00a c014 002f 0035 000a  .........../.5..
	0x0070:  0100 003e 0017 0000 ff01 0001 0000 0a00  ...>............
	0x0080:  0800 0600 1d00 1700 1800 0b00 0201 0000  ................
	0x0090:  2300 0000 1000 0e00 0c02 6832 0868 7474  #.........h2.htt
	0x00a0:  702f 312e 3100 0500 0501 0000 0000 0012  p/1.1...........
	0x00b0:  0000                                     ..
16:10:37.998028 IP (tos 0x0, ttl 64, id 0, offset 0, flags [DF], proto TCP (6), length 52, bad cksum 0 (->3cc2)!)
    127.0.0.1.8080 > 127.0.0.1.56224: Flags [.], cksum 0xfe28 (incorrect -> 0xf789), seq 2526461815, ack 604147290, win 6377, options [nop,nop,TS val 979433461 ecr 979433461], length 0
	0x0000:  4500 0034 0000 4000 4006 0000 7f00 0001  E..4..@.@.......
	0x0010:  7f00 0001 1f90 dba0 9696 bf77 2402 8e5a  ...........w$..Z
	0x0020:  8010 18e9 fe28 0000 0101 080a 3a60 f7f5  .....(......:`..
	0x0030:  3a60 f7f5                                :`..
16:10:37.998768 IP (tos 0x0, ttl 64, id 0, offset 0, flags [DF], proto TCP (6), length 52, bad cksum 0 (->3cc2)!)
    127.0.0.1.8080 > 127.0.0.1.56224: Flags [F.], cksum 0xfe28 (incorrect -> 0xf788), seq 2526461815, ack 604147290, win 6377, options [nop,nop,TS val 979433461 ecr 979433461], length 0
	0x0000:  4500 0034 0000 4000 4006 0000 7f00 0001  E..4..@.@.......
	0x0010:  7f00 0001 1f90 dba0 9696 bf77 2402 8e5a  ...........w$..Z
	0x0020:  8011 18e9 fe28 0000 0101 080a 3a60 f7f5  .....(......:`..
	0x0030:  3a60 f7f5                                :`..
16:10:37.998797 IP (tos 0x0, ttl 64, id 0, offset 0, flags [DF], proto TCP (6), length 52, bad cksum 0 (->3cc2)!)
    127.0.0.1.56224 > 127.0.0.1.8080: Flags [.], cksum 0xfe28 (incorrect -> 0xf786), seq 604147290, ack 2526461816, win 6379, options [nop,nop,TS val 979433461 ecr 979433461], length 0
	0x0000:  4500 0034 0000 4000 4006 0000 7f00 0001  E..4..@.@.......
	0x0010:  7f00 0001 dba0 1f90 2402 8e5a 9696 bf78  ........$..Z...x
	0x0020:  8010 18eb fe28 0000 0101 080a 3a60 f7f5  .....(......:`..
	0x0030:  3a60 f7f5                                :`..
16:10:37.998991 IP (tos 0x0, ttl 64, id 0, offset 0, flags [DF], proto TCP (6), length 52, bad cksum 0 (->3cc2)!)
    127.0.0.1.56224 > 127.0.0.1.8080: Flags [F.], cksum 0xfe28 (incorrect -> 0xf785), seq 604147290, ack 2526461816, win 6379, options [nop,nop,TS val 979433461 ecr 979433461], length 0
	0x0000:  4500 0034 0000 4000 4006 0000 7f00 0001  E..4..@.@.......
	0x0010:  7f00 0001 dba0 1f90 2402 8e5a 9696 bf78  ........$..Z...x
	0x0020:  8011 18eb fe28 0000 0101 080a 3a60 f7f5  .....(......:`..
	0x0030:  3a60 f7f5                                :`..
16:10:37.999051 IP (tos 0x0, ttl 64, id 0, offset 0, flags [DF], proto TCP (6), length 52, bad cksum 0 (->3cc2)!)
    127.0.0.1.8080 > 127.0.0.1.56224: Flags [.], cksum 0xfe28 (incorrect -> 0xf786), seq 2526461816, ack 604147291, win 6377, options [nop,nop,TS val 979433462 ecr 979433461], length 0
	0x0000:  4500 0034 0000 4000 4006 0000 7f00 0001  E..4..@.@.......
	0x0010:  7f00 0001 1f90 dba0 9696 bf78 2402 8e5b  ...........x$..[
	0x0020:  8010 18e9 fe28 0000 0101 080a 3a60 f7f6  .....(......:`..
	0x0030:  3a60 f7f5                                :`..
```

**Comment by saroar** [comment]
here logs are empty as this server don't get any request on xcode
```
Last login: Fri Dec 18 16:04:17 on ttys008
alif@Saroars-MacBook-Pro ~ %
alif@Saroars-MacBook-Pro ~ % sudo tcpdump -i lo0 -nnvvXSs 8000 host 127.0.0.1 and port 3030
Password:
tcpdump: listening on lo0, link-type NULL (BSD loopback), capture size 8000 bytes
16:10:20.201147 IP (tos 0x0, ttl 64, id 0, offset 0, flags [DF], proto TCP (6), length 64, bad cksum 0 (->3cb6)!)
    127.0.0.1.56202 > 127.0.0.1.3030: Flags [S], cksum 0xfe34 (incorrect -> 0xfe9e), seq 2405407780, win 65535, options [mss 16344,nop,wscale 6,nop,nop,TS val 979415793 ecr 0,sackOK,eol], length 0
	0x0000:  4500 0040 0000 4000 4006 0000 7f00 0001  E..@..@.@.......
	0x0010:  7f00 0001 db8a 0bd6 8f5f 9c24 0000 0000  ........._.$....
	0x0020:  b002 ffff fe34 0000 0204 3fd8 0103 0306  .....4....?.....
	0x0030:  0101 080a 3a60 b2f1 0000 0000 0402 0000  ....:`..........
16:10:20.201280 IP (tos 0x0, ttl 64, id 0, offset 0, flags [DF], proto TCP (6), length 64, bad cksum 0 (->3cb6)!)
    127.0.0.1.3030 > 127.0.0.1.56202: Flags [S.], cksum 0xfe34 (incorrect -> 0xab5f), seq 2631387396, ack 2405407781, win 65535, options [mss 16344,nop,wscale 6,nop,nop,TS val 979415793 ecr 979415793,sackOK,eol], length 0
	0x0000:  4500 0040 0000 4000 4006 0000 7f00 0001  E..@..@.@.......
	0x0010:  7f00 0001 0bd6 db8a 9cd7 c904 8f5f 9c25  ............._.%
	0x0020:  b012 ffff fe34 0000 0204 3fd8 0103 0306  .....4....?.....
	0x0030:  0101 080a 3a60 b2f1 3a60 b2f1 0402 0000  ....:`..:`......
16:10:20.201307 IP (tos 0x0, ttl 64, id 0, offset 0, flags [DF], proto TCP (6), length 52, bad cksum 0 (->3cc2)!)
    127.0.0.1.56202 > 127.0.0.1.3030: Flags [.], cksum 0xfe28 (incorrect -> 0x0c69), seq 2405407781, ack 2631387397, win 6379, options [nop,nop,TS val 979415793 ecr 979415793], length 0
	0x0000:  4500 0034 0000 4000 4006 0000 7f00 0001  E..4..@.@.......
	0x0010:  7f00 0001 db8a 0bd6 8f5f 9c25 9cd7 c905  ........._.%....
	0x0020:  8010 18eb fe28 0000 0101 080a 3a60 b2f1  .....(......:`..
	0x0030:  3a60 b2f1                                :`..
16:10:20.201333 IP (tos 0x0, ttl 64, id 0, offset 0, flags [DF], proto TCP (6), length 52, bad cksum 0 (->3cc2)!)
    127.0.0.1.3030 > 127.0.0.1.56202: Flags [.], cksum 0xfe28 (incorrect -> 0x0c69), seq 2631387397, ack 2405407781, win 6379, options [nop,nop,TS val 979415793 ecr 979415793], length 0
	0x0000:  4500 0034 0000 4000 4006 0000 7f00 0001  E..4..@.@.......
	0x0010:  7f00 0001 0bd6 db8a 9cd7 c905 8f5f 9c25  ............._.%
	0x0020:  8010 18eb fe28 0000 0101 080a 3a60 b2f1  .....(......:`..
	0x0030:  3a60 b2f1                                :`..

```

**Comment by Lukasa** [comment]
Ok, so we observe the connection to the backend being created, but no writes are sent. This is in line with our logs from earlier.

What's the CPU usage of your gateway application after you make your request? Is it using 100% CPU?

**Comment by saroar** [comment]
<img width="307" alt="image" src="https://user-images.githubusercontent.com/8770772/102618872-951da500-414c-11eb-9863-5a9203e06c6b.png">

**Comment by Lukasa** [comment]
Yes, I did wonder about that. Can you add a breakpoint on `System.swift` line 171 and tell me if it's being hit?

**Comment by saroar** [comment]
<img width="1046" alt="Screenshot 2020-12-18 at 16 22 12" src="https://user-images.githubusercontent.com/8770772/102619293-48869980-414d-11eb-8623-e6ba14dd3783.png">

**Comment by Lukasa** [comment]
Yeah, I thought so. I was a bit suspicious of how consistently you were hitting `EPROTOTYPE`, given that in my testing I could only hit it very rarely.

Did you try changing from `0.0.0.0` to `127.0.0.1`?

**Comment by saroar** [comment]
u mean here ?
```
  switch app.environment {
  case .production:
    app.http.server.configuration.hostname = "0.0.0.0"
    app.http.server.configuration.port = 8080
  case .development:
    app.http.server.configuration.port = 8080
    app.http.server.configuration.hostname = "0.0.0.0"
  default:
    app.http.server.configuration.port = 8080
    app.http.server.configuration.hostname = "0.0.0.0"
  }
```

**Comment by Lukasa** [comment]
No, I mean in your `AUTH_URL` environment variable.

**Comment by saroar** [comment]
its work `127.0.0.1`

**Comment by Lukasa** [comment]
That fixed your problem?

**Comment by saroar** [comment]
yes

**Comment by Lukasa** [comment]
Ok, this implies that there is a behavioural change in xnu that has affected this. I think that I will actually _revert_ the change in NIO for now as I believe it made this failure mode worse instead of better, and we will file a radar against xnu.

**Comment by saroar** [comment]
yaa as i told you it was problem after update MacOS Big Sur 11.1
